,Authors,Title,Year,Source,Abstract,countries
0,"SA Matrevi, KZ Tandoh, S Bruku, P Opoku-Agyeman…",Novel pfk13 polymorphisms in Plasmodium falciparum population in Ghana,2014,Scientific Reports,"… However, pfk13 mutations which may confer parasite … pfk13 gene polymorphisms in malaria therapeutic efficacy studies for functional characterization. We herein report all novel pfk13 …",Ghana
3,"M Hawkes, AL Conroy, RO Opoka…","Slow clearance of Plasmodium falciparum in severe pediatric malaria, Uganda, 2011–2013",2014,Emerging infectious …,… Plasmodium falciparum resistance to artemisinin derivatives is emerging in Asia. … Uganda who had severe malaria and were treated with intravenous artesunate. We observed in the K13…,Uganda
9,"A Osborne, JE Phelan, A Kaneko, W Kagaya…","Drug resistance profiling of asymptomatic and low-density Plasmodium falciparum malaria infections on Ngodhe island, Kenya, using custom dual-indexing …",2014,Scientific Reports,"… Our analysis was able to quantify molecular markers of resistance on the Pfcrt, Pfmdr1, Pfdhps, Pfdhfr, and Pfk13 genes, establishing this method as a viable means of malaria …",Kenya
11,MD Eskild Petersen,The first case of artemisinin treatment failure of Plasmodium falciparum imported to Oman from Tanzania,2014,Journal of Travel Medicine,"… PfATPase6 and Pfkelch13 alone or in combination, we generated two mutant lines using P. falciparum NF54 wild-type laboratory strain (ie parasites with no mutation in Pfkelch13) using …",Tanzania
12,"AF Somé, H Sorgho, I Zongo, T Bazié, F Nikiéma…","Polymorphisms in K13, pfcrt, pfmdr1, pfdhfr, and pfdhps in parasites isolated from symptomatic malaria patients in Burkina Faso",2014,Parasite,"… The absence of known mutations in the k13 propeller gene augurs … malaria transmission. Nevertheless, a recent study reported the identification of a unique K13 mutation from Ethiopia […",Burkina Faso
13,"OJ Afolabi, RO Oluwafemi, MO Oniya","Distribution of Pfmdr 1 and Kelch 13 Genes Among the Children 5 Years and Below Attending a Secondary Health Facility, South-West, Nigeria.",2014,,"… On the other hand, K13 mutant falciparum isolates were highly prevalent in Binh Phuoc and Dak Nong provinces of Vietnam and in these 2 provinces, only the C580Y mutant was …",Nigeria
17,WA OKORE,… falciparum multi-drug resistance protein 1 gene mutations during implementation of artemisinin combination therapies between 2008 and 2019 in Kenya,2014,,,Kenya
19,"DS Ishengoma, CI Mandara, C Bakari…",Evidence of artemisinin partial resistance in northwestern Tanzania: clinical and molecular markers of resistance,2014,The Lancet Infectious …,"… Haplotype analysis showed that parasites with the k13 … Asia and Rwanda, but had the same haplotype (Tanzania haplotype … falciparum kelch13 R561H mutant parasites in Rwanda. Nat …",Tanzania
21,"G Manirakiza, K Kassaza, IM Taremwa, J Bazira…","Molecular identification and anti-malarial drug resistance profile of Plasmodium falciparum from patients attending Kisoro Hospital, southwestern Uganda",2014,Malaria Journal,"… Coartem®) (kelch13). This study focused only on the kelch13 C580Y mutation for resistance … For kelch13 propeller gene, the following primers and probe were used: Forward Primer: 5’-…",Uganda
22,"U Igbasi, W Oyibo, S Omilabu, H Quan…","Kelch 13 propeller gene polymorphism among Plasmodium falciparum isolates in Lagos, Nigeria: Molecular Epidemiologic Study",2014,Tropical Medicine & …,… falciparum to artemisinin is scarce. Previous studies showed that … all falciparum-endemic countries. The aim of this study was to determine K13 polymorphism in Plasmodium falciparum …,Nigeria
27,"JJ Juliano, DJ Giesbrecht, A Simkin, AA Fola…",… resistance mutations with evidence for multiple origins and expansion of high level sulfadoxine-pyrimethamine resistance mutations in northwest Tanzania,2014,medrxiv,"… for malaria elimination. The emergence of Plasmodium falciparum Kelch13 (K13) R561H in Rwanda raised concern about the impact in neighboring Tanzania. In addition, regional …",Tanzania
29,"SA Matrevi, P Opoku-Agyeman…",Plasmodium falciparum kelch propeller polymorphisms in clinical isolates from Ghana from 2007 to 2016,2014,Antimicrobial agents …,"… of parasites to ACT in Kenya and recurrent imported malaria in Britain, were observed in 7.4%, … pfk13 polymorphisms in Ghanaian P. falciparum populations from uncomplicated malaria …",Ghana
30,"Z Zhou, JE Gimnig, SB Sergent, Y Liu, B Abong'o…","… of drug resistance in Plasmodium falciparum in human blood and profiles of corresponding resistant markers in mosquito oocysts in Asembo, western Kenya",2014,Malaria journal,… SNP mutations in the Kelch 13 gene (Pfk13) are associated with … Pfk13 R561H in Rwanda and Pfk13 A675V and C469Y in Uganda are associated with delayed clearance of malaria …,Kenya
33,"OJ AFOLABI, OR Oluwafemi, MO Oniya","Distribution of Pfmdr 1 and Kelch 13 Genes among the Children 5 Years and Below Attending a Secondary Health Facility in Akure, South-West, Nigeria.",2014,,"… falciparum kelch protein gene on chromosome 13 (Pfkelch13… of Pfmdr 1 and PfKelch 13 genes among the under-5 … , Gambia, Kenya, Madagascar, Malawi, Mali, Rwanda, Togo, Uganda, …",Nigeria
34,"AA Jalei, K Na-Bangchang, P Muhamad…",Monitoring antimalarial drug-resistance markers in Somalia,2014,"Parasites, Hosts and …","… falciparum Kelch-13 gene. This study revealed that chloroquine resistance markers are present at high frequencies, while the parasite remains sensitive to artemisinin (ART). The …",Somalia
36,"MD Conrad, SL Nsobya…",The Diversity of the Plasmodium falciparum K13 Propeller Domain Did Not Increase after Implementation of Artemisinin-Based Combination Therapy in Uganda,2014,Antimicrobial agents and …,"… of care to treat uncomplicated falciparum malaria. However, … encoding the Plasmodium falciparum K13 protein (K13PD). … use from seven sites across Uganda. We detected K13PD NS-…",Uganda
37,"E Aninagyei, CD Tetteh, M Oppong, A Boye…",Efficacy of Artemether-Lumefantrine on various Plasmodium falciparum Kelch 13 and Pfmdr1 genes isolated in Ghana,2014,Parasite Epidemiology …,"… falciparum parasites circulating in a defined endemic area for efficient management of malaria. Hence, the objective of the study was to assess the impact of Kelch 13 mutations on the …",Ghana
38,"DS Ishengoma, CI Mandara, C Bakari, AA Fola…",Evidence of artemisinin partial resistance in North-western Tanzania: clinical and drug resistance markers study,2014,MedRxiv,"… Tanzania, a nationwide molecular malaria surveillance in 2021 showed a high prevalence of the Kelch13 (K13) 561H mutation in Plasmodium falciparum … with Rwanda and Uganda. …",Tanzania
42,"JJ Juliano, DJ Giesbrecht, A Simkin, AA Fola…",Prevalence of mutations associated with artemisinin partial resistance and sulfadoxine–pyrimethamine resistance in 13 regions in Tanzania in 2021: a cross …,2014,The Lancet …,"… Using 6855 P falciparum positive samples successfully sequenced using molecular inversion probes from across Tanzania, we show that the k13 Arg561His mutation has become …",Tanzania
44,"RJA Mohamed, J Kitau, C Rasmussen, JA Bailey5ǂ…",Evidence of artemisinin partial resistance in North-western Tanzania: clinical and drug resistance markers study,2014,academia.edu,"… Tanzania, a nationwide molecular malaria surveillance in 2021 showed a high prevalence of the Kelch13 (K13) 561H mutation in Plasmodium falciparum … with Rwanda and Uganda. …",Tanzania
47,"B Pc, S Mong'are, R Masai, D Matoke-muhia","… , absent K13 gene polymorphisms and observation of amino-acids silent mutations among malaria non-responsive patients: A case study of Kisii County, Kenya.",2014,,"… falciparum Kelch13 propeller gene among malaria non-responsive patients who attended selected hospitals in endemic regions of Kisii County, Kenya. The … Upon sequencing the K13-…",Kenya
48,"W Chebore, Z Zhou, N Westercamp, K Otieno, YP Shi…",Assessment of molecular markers of anti-malarial drug resistance among children participating in a therapeutic efficacy study in western Kenya,2014,Malaria Journal,… falciparum kelch 13 (Pfk13) propeller region have been causally … Pfk13 propeller region mutations that have been associated with artemisinin resistance. The absence of these Pfk13 …,Kenya
51,"E Ayogu, M Adibe, K Ugwu, M Agbo, A Mukhtar…",Molecular Surveillance of Plasmodium Falciparum Kelch 13 Gene in Nigeria: Sixteen Years after the Introduction of Artemisinin Combination Therapy,2014,Available at SSRN …,"… falciparum k13 gene are markers for monitoring 26 … resistance, hence this work assessed the presence of Pfk13 … malaria at sites of varying transmission intensity in Uganda. J Invest 565 …",Nigeria
57,"V Osoti, K Wamae, L Ndwiga, PM Gichuki, C Okoyo…","Detection of Low-Frequency Artemisinin Resistance Mutations C469Y, P553L and A675V in Asymptomatic Primary School Children in Kenya",2015,,… Emergence and clonal expansion of in vitro artemisinin-resistant Plasmodium falciparum kelch13 R561H mutant parasites in Rwanda. Nature Medicine. https://doi.org/10.1038/s41591-…,Kenya
62,"CC Dieng, V Morrison, D Donu, L Cui, L Amoah…",Distribution of Plasmodium falciparum K13 gene polymorphisms across transmission settings in Ghana,2015,BMC Infectious …,"… In this study, we compared Pfk13 sequences obtained from 172 P. falciparum samples across … The Pfk13 gene diversity was most pronounced in the northern savannah than the central …",Ghana
65,"BG Brhane, AA Fola, H Nigussie, A Leonetti, M Kassa…",Rising prevalence of Plasmodium falciparum artemisinin resistance mutations in Ethiopia,2015,medRxiv,… Author Correction: Emergence and clonal expansion of in vitro 561 artemisinin-resistant Plasmodium falciparum kelch13 R561H mutant parasites in 562 Rwanda. Nat. Med. …,Ethiopia
67,LM Ndwiga,"Molecular Analysis of Antimalarial Resistance Markers in Parasite Samples Obtained From Children Recruited Into a Drug Efficacy Trial in Kwale, Kenya, 2013.",2015,,… Specific non-synonymous mutations in the kelch propeller domain of Plasmodium falciparum chromosome 13 (k13) mutations have been identified as the suitable marker for artemisinin …,Kenya
68,"HN Mukhongo, JK Kinyua, YG Weldemichael…",Plasmodium falciparum dried-blood spots from three hospital s of Eritrea [version 3; peer review: 2 approved],2015,media.malariaworld.org,"… PfK-13 mutation R622I, first reported in Ethiopia,43 has later been seen to spread into Somalia,44 Eritrea,45 Uganda,… of the corresponding point mutations in PfK-13, were detected. This …",Eritrea
69,"PK Tumwebaze, MD Conrad, M Okitwi, S Orena…",Decreased susceptibility of Plasmodium falciparum to both dihydroartemisinin and lumefantrine in northern Uganda,2015,Nature …,"… To better appreciate the current situation, we directly compared the drug susceptibilities of isolates collected in 2021 from malaria patients in northern Uganda, where the PfK13 …",Uganda
72,"M Ikeda, M Kaneko, SI Tachibana…","Artemisinin-resistant Plasmodium falciparum with high survival rates, Uganda, 2014–2016",2015,Emerging infectious …,"… isolates obtained directly from patients with acute falciparum malaria demonstrated associations between PfKelch13 mutations and upregulation of unfolded protein response, one of …",Uganda
80,"RA Cooper, MD Conrad, QD Watson…",Lack of artemisinin resistance in Plasmodium falciparum in Uganda based on parasitological and molecular assays,2015,Antimicrobial agents …,… falciparum isolates from Africa. We characterized artemisinin sensitivity by … K13 polymorphisms in isolates from Uganda. Parasites were collected from patients diagnosed with malaria …,Uganda
83,"C Schreidah, D Giesbrecht, P Gashema, NW Young…","… of artemisinin partial resistance mutations and lack of histidine rich protein-2 and -3 deletions in Plasmodium falciparum infections from Rukara, Rwanda",2015,Malaria Journal,… a threat to malaria control in Africa. Plasmodium falciparum kelch13 (k13) propeller-domain mutations that confer artemisinin partial resistance have emerged in Africa. k13-561H was …,Rwanda
85,"A Boussaroque, B Fall, M Madamet…","Emergence of mutations in the K13 propeller gene of Plasmodium falciparum isolates from Dakar, Senegal, in 2013-2014",2015,Antimicrobial agents …,"… in Southeast Asia, was detected in Kenya and Malawi (12). … We collected 103 samples from falciparum malaria patients … A malaria diagnosis was confirmed using a thin blood smear, …",Senegal
87,"AK Subudhi, AL Bienvenu, G Bonnot…",The first case of artemisinin treatment failure of Plasmodium falciparum imported to Oman from Tanzania,2015,Journal of travel …,"… To evaluate if the artemisinin resistance observed in the Pfa-alm parasite was conferred by NS mutations in the PfATPase6 and Pfkelch13 alone or in combination, we generated two …",Tanzania
88,"C Ebong, A Sserwanga, JF Namuganga, J Kapisi…",… of uncomplicated Plasmodium falciparum malaria and prevalence of molecular markers associated with artemisinin and partner drug resistance in Uganda,2015,Malaria Journal,"… falciparum kelch 13 (Pfk13) gene are associated with artemisinin partial resistance, and 10 of these SNPs have a validated association: F446I, N458Y, M476I, Y493H, R539T, I543T, …",Uganda
90,"M Warsame, AM Hassan, AH Hassan, AM Jibril…",High therapeutic efficacy of artemether–lumefantrine and dihydroartemisinin–piperaquine for the treatment of uncomplicated falciparum malaria in Somalia,2015,Malaria journal,"… , respectively, for uncomplicated falciparum malaria in Somalia. The studies … falciparum K13-propeller (Pfk13) domain and amplification in Pfplasmepsin 2 (Pfpm2) gene in Somalia…",Somalia
91,"MS Yade, B Dièye, R Coppée, A Mbaye, MA Diallo…","Ex vivo RSA and pfkelch13 targeted-amplicon deep sequencing reveal parasites susceptibility to artemisinin in Senegal, 2017",2015,Malaria Journal,"… (AL) as the first-line treatment for uncomplicated malaria [3]. However, recent reports of the … malaria endemic countries [4], the local emergences of ART-R in Rwanda and in Uganda, …",Senegal
93,"S Tukwasibwe, S Garg, T Katairo, V Asua…",Varied prevalence of antimalarial drug resistance markers in different populations of newly arrived refugees in Uganda,2015,The Journal of …,"… In Uganda, 5 different PfK13 propeller domain mutations that are validated or candidate … We studied malaria parasites infecting refugees who had recently arrived in Uganda from South …",Uganda
99,"HN Mukhongo, JK Kinyua, YG Weldemichael…",Screening for antifolate and artemisinin resistance in Plasmodium falciparum clinical isolates from three hospitals of Eritrea [version 1; peer review: awaiting …,2015,,"… falciparum kelch 13 gene (Pfk13).ART resistance is primarily characterized by delayed … in PfK-13, which is similar to other studies from Eritrea25 and Kenya26,27 including other malaria …",Eritrea
100,"JA Djaman, D Olefongo, AB Ako, J Roman…",Molecular epidemiology of malaria in cameroon and cote d'ivoire. xxxi. kelch 13 propeller sequences in plasmodium falciparum isolates before and after …,2015,The American Journal …,"… the sequence polymorphism in K13-propeller gene of P. falciparum isolates that were collected before … Moreover, the same study reported that continuous cultivation of F32-Tanzania P. …",cameroon
105,LJ Chebon,"… genetics of Plasmodium falciparum parasites exposed to artemisinin treatment in patients taking part in an efficacy clinical trial in Kisumu county, western Kenya.",2015,,"… falciparum strains. Similarly, the 91 SNPs have previously … Interestingly, no SNPs in the K13-propeller gene were observed … genetic markers associated with ACTs resistance in Kenya. …",Kenya
106,"M Hussien, MM Abdel Hamid, EA Elamin, AO Hassan…",Antimalarial drug resistance molecular makers of Plasmodium falciparum isolates from Sudan during 2015–2017,2015,PLoS …,… The most frequent Pfk13 mutation was E433D detected in four samples. All of the Pfk13 … in Equatorial Guinea [27] and another in Uganda [28]. The latter mutations were C580Yand …,Sudan
109,LJ Chebon,Population genetics of plasmodium falciparum parasites taking part in an efficacy clinical trial ii Kisumu county western kenya.,2015,,"… falciparum strains. Similarly, the 91 SNPs have previously … Interestingly, no SNPs in the K13-propeller gene were observed … genetic markers associated with ACTs resistance in Kenya. …",kenya
110,"G Russo, M L'Episcopia, M Menegon, SS Souza…",Dihydroartemisinin–piperaquine treatment failure in uncomplicated Plasmodium falciparum malaria case imported from Ethiopia,2015,Infection,"… recrudescence, 30 days post-treatment with DHA–PPQ, of a traveller returning from Ethiopia after visiting friends or relatives (VFR). No known mutations in the PfK13 gene were …",Ethiopia
114,"A Osborne, E Manko, M Takeda, A Kaneko…","Characterizing the genomic variation and population dynamics of Plasmodium falciparum malaria parasites in and around Lake Victoria, Kenya",2015,Scientific Reports,"… falciparum isolates in the Lake region of Kenya, which has … falciparum isolates from Lake Victoria form a cluster within … falciparum genetic diversity within the Lake Victoria basin, a …",Kenya
116,"K Diongue, J Bailly, A Mama, A Fall, AB Thiaw…","Ex vivo RSA and pfkelch13 targeted-amplicon deep sequencing reveal parasites susceptibility to artemisinin in Senegal, 2017",2015,,… High prevalence of Plasmodium falciparum K13 mutations in Rwanda is associated with slow parasite clearance after treatment with artemether‑lumefantrine. J Infect Dis. 2022;225:…,Senegal
125,"E Lo, E Hemming-Schroeder, D Yewhalaw…",Transmission dynamics of co-endemic Plasmodium vivax and P. falciparum in Ethiopia and prevalence of antimalarial resistant genotypes,2015,PLoS neglected …,"… , malaria control efforts should focus on seasonal migrant populations to effectively reduce malaria burden in Ethiopia. … with our finding of predominantly wild type pfK13 genotypes in P. …",Ethiopia
126,"JE Laury, K Mugittu, DC Kajeguka…","Efficacy and Safety of Artemether-Lumefantrine Against Uncomplicated Falciparum Malaria Infection in Tanzania, 2022: A Single-Arm Clinical Trial",2015,The Journal of …,… for the treatment of uncomplicated malaria in Tanzania. The World Health Organization … falciparum malaria in Tanzania in 2022. … SANGER sequencing was used to detect K13 mutations. …,Tanzania
128,"HM Topazian, KA Moser, B Ngasala…",Low Complexity of Infection Is Associated With Molecular Persistence of Plasmodium falciparum in Kenya and Tanzania,2015,Frontiers in …,"… and the R561H K13 mutation in Rwanda, and the emergence of resistance in Uganda are of … Such variation in clearance may complicate efforts to disentangle the effects of K13 or other …","Kenya, Tanzania"
129,"NF Brazeau, A Assefa, H Mohammed…",Pooled deep sequencing of drug resistance loci from Plasmodium falciparum parasites across Ethiopia,2015,The American Journal …,"… other studies of kelch13 mutations in Ethiopia, we … , Ethiopia’s malaria transmission intensity remains low, with only 1.2% and 0.5% of children being malaria positive in the 2015 Malaria …",Ethiopia
131,"M Maraka, HM Akala, AS Amolo, D Juma, D Omariba…",A seven-year surveillance of epidemiology of malaria reveals travel and gender are the key drivers of dispersion of drug resistant genotypes in Kenya,2015,PeerJ,"… in malaria epidemic zones in Kenya. A total of 1,776 individuals presenting with uncomplicated malaria at hospitals selected from four malaria transmission zones in Kenya between …",Kenya
136,"L Golassa, E Kamugisha, DS Ishengoma, V Baraka…","Identification of large variation in pfcrt, pfmdr-1 and pfubp-1 markers in Plasmodium falciparum isolates from Ethiopia and Tanzania",2015,Malaria journal,"… Mutations in the kelch 13 gene have been associated with the slow clearance phenotype in … However, the variability of the K13 gene is low in African isolates and background mutations …","Ethiopia, Tanzania"
140,"KB Beshir, N Sepúlveda, J Bharmal, A Robinson…",Plasmodium falciparum parasites with histidine-rich protein 2 (pfhrp2) and pfhrp3 gene deletions in two endemic regions of Kenya,2015,Scientific reports,… falciparum lacking the pfhrp2 gene in two areas of Kenya. Eight of 89 (9%) samples analyzed from western Kenya were pfhrp2-deleted; and genomic data from eastern Kenya identified …,Kenya
142,"S Mihreteab, L Platon, A Berhane…",Increasing prevalence of artemisinin-resistant HRP2-negative malaria in Eritrea,2015,… England Journal of …,… falciparum parasitemia 3 days after the initiation of therapy). We also assayed parasites for mutations in Pfkelch13 … resistance to artemisinin in Rwanda and Uganda is a major concern. …,Eritrea
145,"HN Mukhongo, JK Kinyua, YG Weldemichael…",Screening for antifolate and artemisinin resistance in Plasmodium falciparum dried-blood spots from three hospitals of Eritrea,2015,…,"… Information describing malaria transmission in Eritrea, Pfk13 non-… PfK-13 mutation R622I, first reported in Ethiopia, 43 has later been seen to spread into Somalia, 44 Eritrea, 45 Uganda, …",Eritrea
155,"ER Ebel, F Reis, DA Petrov, S Beleza",Historical trends and new surveillance of Plasmodium falciparum drug resistance markers in Angola,2015,Malaria journal,"… including Malawi, the Gambia, Kenya, Ethiopia, Tanzania, and Grand Comore has led to … Finally, we detected no signs of alleles in kelch13 that confer partial resistance to artemisinin…",Angola
158,"MS Issa, M Warsame, MHT Mahamat, IDM Saleh…",Therapeutic efficacy of artesunate–amodiaquine and artemether–lumefantrine for the treatment of uncomplicated falciparum malaria in Chad: clinical and …,2015,Malaria Journal,"… falciparum kelch13 (pfkelch13) gene have been documented to be associated with ART-R [5… and expansion of validated pfkelch13 mutations in Rwanda (R561H), Uganda (A675V or …",Chad
162,"G Kishoyian, ENM Njagi, GO Orinda…",Efficacy of artemisinin–lumefantrine for treatment of uncomplicated malaria after more than a decade of its use in Kenya,2015,Epidemiology & …,… falciparum kelch 13 resulting in a prolonged parasite … brought about by the pfkelch13 M476I mutation while sustained … The prevalence of these mutant alleles of k13 has been shown to …,Kenya
163,"E Rogier, N Battle, C Bakari, MD Seth, D Nace…",Plasmodium falciparum pfhrp2 and pfhrp3 gene deletions among patients enrolled at 100 health facilities throughout Tanzania: February to July 2021,2015,Scientific Reports,"… Tanzania is a country of heterogenous P. falciparum transmission, with some regions … facilities encompassing 10 regions of Tanzania enrolled malaria-suspected patients between …",Tanzania
172,"V Baraka, G Makenga, F Francis, RA Kavishe…","… Genetic profiling of molecular markers of antimalarial resistance in areas targeted for school-based malaria chemoprevention strategies in North-Eastern, Tanzania",2015,,… expansion of the malaria preventive chemotherapies to include … artemisinin resistance based on PfKelch13 mutations in Eastern … of IPTsc intervention in a highly malaria endemic area. …,Tanzania
177,"H Gupta, G Matambisso, B Galatas, P Cisteró…",Molecular surveillance of pfhrp2 and pfhrp3 deletions in Plasmodium falciparum isolates from Mozambique,2015,Malaria journal,"… First, a nested PCR targeting single copy k13 gene (nPCR k13 ) was performed to verify the … falciparum isolates that were negative by nPCR targeting kelch13 gene was 2.17 parasites/…",Mozambique
179,"KA Moser, RA Madebe, O Aydemir…",Describing the current status of Plasmodium falciparum population structure and drug resistance within mainland Tanzania using molecular inversion probes,2015,Molecular …,"… in seven administrative regions across Tanzania, and parasites … falciparum parasites, approximately separating parasites … districts (including two infections carrying pfk13‐R561H), and …",Tanzania
181,"RA Kavishe, P Paulo, RD Kaaya, A Kalinga…",Surveillance of artemether-lumefantrine associated Plasmodium falciparum multidrug resistance protein-1 gene polymorphisms in Tanzania,2015,Malaria journal,"… Recently, ACT resistance associated K13 propeller protein … Together with the Pfmdr1 ALu-associated haplotypes the K13 … treatment policy implementation in Tanzania there is scarcity …",Tanzania
184,"SD Sene, MN Pouye, RM Martins, F Diallo…",Identification of an in vitro artemisinin-resistant Plasmodium falciparum kelch13 R515K mutant parasite in Senegal,2015,Frontiers in …,… falciparum clinical isolate carrying R515K mutation in the artemisinin resistance gene PfKelch13. … Gene editing has confirmed that PfKelch13 R515K drove increased in vitro RSA 0-3hpi …,Senegal
187,"PK Tumwebaze, T Katairo, M Okitwi…",Drug susceptibility of Plasmodium falciparum in eastern Uganda: a longitudinal phenotypic and genotypic study,2015,The Lancet …,"… with decreased susceptibility to artemisinins, characterised by delayed clearance after treatment and the presence of kelch 13 (PfK13) propeller domain mutations, has emerged in the …",Uganda
188,"ST Girgis, E Adika, FE Nenyewodey…",Drug resistance and vaccine target surveillance of Plasmodium falciparum using nanopore sequencing in Ghana,2015,Nature …,"… , which is caused by mutations in the gene kelch13 (refs. ), has now been identified in multiple east African countries including Rwanda 16,17,18 , Uganda 19,20 and Eritrea 2 . Partial …",Ghana
