,Authors,Title,Year,Source,Abstract,countries
425,"W Zhao, X Li, Q Yang, L Zhou, M Duan…",In vitro susceptibility profile of Plasmodium falciparum clinical isolates from Ghana to antimalarial drugs and polymorphisms in resistance markers,2017,Frontiers in Cellular …,… Ghana adopted ACTs as the frontline treatment of uncomplicated falciparum malaria in 2005… This study did not detect pfk13 propeller domain mutations in the 29 parasite isolates. Since …,Ghana
427,"R Zhou, C Yang, S Li, Y Zhao, Y Liu…","Molecular surveillance of drug resistance of Plasmodium falciparum isolates imported from Angola in Henan Province, China",2017,Antimicrobial agents …,"… K13 mutation frequency and distribution as a result of the analysis of 14,037 samples collected in 59 countries in which malaria … , which was also observed in Kenya from 2005 to 2015 (…",Angola
430,"MS Cherif, P Dahal, AH Beavogui, A Delamou…",Malaria epidemiology and anti-malarial drug efficacy in Guinea: a review of clinical and molecular studies,2017,Malaria Journal,"… Finally, the recent report of the identification of a de novo emergence of Kelch-13 mediated artemisinin-resistance in Rwanda is a major concern [59, 60], but a recent study conducted in …",Guinea
436,"F Von Wowern, G Makenga, SW Thomsen…",… of selection of antimalarial drug resistance markers after intermittent preventive treatment of schoolchildren (IPTsc) against malaria in northeastern Tanzania,2017,International Journal of …,"… no validated or candidate Pfkelch13 mutations were found in … of Pfkelch13 mutations in north-eastern Tanzania, PfKelch13 … in neighboring countries of Uganda and Rwanda [9,10] and …",Tanzania
439,"LE Mhamilawa, B Aydin-Schmidt…","… chain reaction on day 3 after initiation of artemether–lumefantrine treatment for uncomplicated malaria in Bagamoyo District, Tanzania: a comparative trial",2017,The American Journal …,"… falciparum malaria was first reported from Southeast Asia in 2009 1 ; today, it constitutes a major threat to global malaria … the propeller domain of the kelch 13 gene and is phenotypically …",Tanzania
441,"A Abamecha, D Yilma, W Adissu, D Yewhalaw…",Efficacy and safety of artemether-lumefantrine for treatment of uncomplicated P. Falciparum malaria in Ethiopia: A systematic review and meta-analysis,2017,,"… This study provides evidence for the de novo emergence of Pfkelch13-mediated artemisinin resistance in Rwanda, potentially compromising the continued success of antimalarial …",Ethiopia
458,"B Tornyigah, R Coppée, P Houze, KA Kusi…",Effect of drug pressure on promoting the emergence of antimalarial-resistant parasites among pregnant women in Ghana,2017,Antimicrobial agents …,… pfk13-independent treatment failure in four imported cases of Plasmodium falciparum malaria treated with artemether-lumefantrine in the United Kingdom. Antimicrob Agents …,Ghana
463,"M Ocan, R Bakubi, M Tayebwa, J Basemera, S Nsobya",Experiences of healthcare personnel on the efficacy of artemisinin-based combination therapy and malaria diagnosis in hospitals in Uganda,2017,Malaria Journal,… personnel on malaria diagnosis and self-reported efficacy of ACT in the management … malaria symptomatic patients in hospitals in low and high malaria transmission settings in Uganda. …,Uganda
469,"A Silva-Pinto, J Domingos, M Cardoso, A Reis…",Artemether-lumefantrine treatment failure of uncomplicated Plasmodium falciparum malaria in travellers coming from Angola and Mozambique,2017,International Journal of …,"… high malaria burden regions in Africa and elsewhere. Here, we report on two malaria imported … No evidence of pfk13-mediated artemisinin resistance was found. Both subjects had …",Angola
471,"C Mungo, K Sorgi, C Ogollah, B Misiko, C Cheserem…","Phase I study on the pharmacokinetics of intravaginal, self-administered artesunate vaginal pessaries among women in Kenya",2017,medRxiv,"… in healthy adults and falciparum malaria patients. … In Africa, several studies have identified a number of low-frequency Pfk13 … mutations in the A675V or C469Y allele in the kelch13 gene. …",Kenya
473,"SA Rasmussen, FG Ceja, MD Conrad…",Changing antimalarial drug sensitivities in Uganda,2017,Antimicrobial agents …,"… clearance after therapy and causally linked to mutations in the k13 gene (PF3D7_1343700 ) (21… Considering recent changes in malaria treatment practices in Uganda, we investigated …",Uganda
479,"A Ogouyèmi-Hounto, G Damien, AB Deme, NT Ndam…",Lack of artemisinin resistance in Plasmodium falciparum in northwest Benin after 10 years of use of artemisinin-based combination therapy,2017,Parasite,"… The use of molecular markers such as K13 mutations is nowadays a cornerstone of malaria … Longitudinal studies conducted in Kenya [4, 20] showed that parasites from only one of 32 …",Benin
483,"JN McCaffery, T Munyaneza, A Uwimana…",Symptomatic Plasmodium vivax Infection in Rwanda,2017,Open Forum …,"… P falciparum genes tested. Genotyping for polymorphisms associated with drug resistance, including P falciparum kelch 13 … surveillance and also revealed a lack of P falciparum genes. …",Rwanda
487,"E Wallender, N Zhang, M Conrad…",… of malaria and selection of drug resistance with different dosing schedules of dihydroartemisinin-piperaquine preventive therapy during pregnancy in Uganda,2017,Antimicrobial agents …,"… the complications of placental malaria, including intrauterine … that pregnant women at risk for malaria in Africa use a long-… parasitemia and placental malaria in Uganda and Kenya (5, 6). …",Uganda
492,"M Teklemariam, A Assefa, M Kassa, H Mohammed…",Therapeutic efficacy of artemether-lumefantrine against uncomplicated Plasmodium falciparum malaria in a high-transmission area in northwest Ethiopia,2017,Plos one,"… isolates from numerous sub-Saharan African countries including Ethiopia found no mutations in the parasite’s K13-propeller gene, which is associated with artemisinin resistance in …",Ethiopia
496,"MM Plucinski, PR Dimbu, AP Macaia, CM Ferreira…","… lumefantrine, artesunate–amodiaquine, and dihydroartemisinin–piperaquine for treatment of uncomplicated Plasmodium falciparum malaria in Angola, 2015",2017,Malaria Journal,"… falciparum K13 propeller domain was amplified using a P. falciparum-specific protocol described previously [21]. Two regions of pfmdr1, covering codons 86–184 and 1034–1246, were …",Angola
497,"AM Kebede, E Sutanto, H Trimarsanto…",Genomic analysis of Plasmodium vivax describes patterns of connectivity and putative drivers of adaptation in Ethiopia,2017,Scientific Reports,… falciparum candidate artemisinin partial resistance kelch13 R622I mutation across three regions of Ethiopia 46 . Although the R622I mutant has not been validated as a determinant of …,Ethiopia
500,"M Guerra, R Neres, P Salgueiro…",Plasmodium falciparum genetic diversity in continental Equatorial Guinea before and after introduction of artemisinin-based combination therapy,2017,Antimicrobial agents …,"… Further, to monitor the use of ACT, we provide the baseline prevalences of K13 propeller … (SNPs) were observed in the K13 gene, suggesting that closer monitoring should be …",Equatorial Guinea
502,"P Berzosa, I Molina de la Fuente, TH Ta-Tang…",Temporal evolution of the resistance genotypes of Plasmodium falciparum in isolates from Equatorial Guinea during 20 years (1999 to 2019),2017,Malaria Journal,"… as south eastern Cameroon [19], Kenya and Malawi, have suggested that the withdrawal of … falciparum genes pfdhfr, pfdhps, pfmdr1, pfcrt and pfk13 were analysed. Mutation screening …",Equatorial Guinea
507,"MK Bezabih, T Misganaw, LA Ejigu, S Rosillo, H Teka…",… in Adults with Plasmodium Falciparum with High Prevalence of Markers of Partial Artemisinin Resistance and Pfhrp2/3 Gene Deletions in Ethiopia: A Single-Blind …,2017,papers.ssrn.com,… Background: The emergence and expansion of Plasmodium falciparum parasites with … recent gains in malaria control. P. falciparum parasites that carry pfkelch13 622I are uniquely …,Ethiopia
508,"T Chege, A Cole, R Aman, G Githuka, R Muga…",… System Challenges Associated with Deployment of Multiple First Line Treatment for Uncomplicated Malaria: A Pilot Study in a Malaria-Endemic Region of Kenya,2017,Available at SSRN …,"… of current ACTs for uncomplicated malaria. This is because … as Rwanda 5,6. This increased parasite clearance time has been found to be associated with Falciparum Kelch13 (PfKelch13…",Kenya
510,"RO Mwaiswelo, B Ngasala, D Msolo, E Kweka…","… sufficient to reduce transmission of Plasmodium falciparum gametocytes regardless of cytochrome P450 2D6 enzyme activity in Bagamoyo district, Tanzania",2017,Malaria Journal,"… Malaria transmission in the area is moderate with an incidence rate of 69.1 per 1000 … uncomplicated malaria in Tanzania since 2006 [39], and primaquine is now included in the malaria …",Tanzania
513,"RJ Zupko, TD Nguyen, AF Somé…",Long-term effects of increased adoption of artemisinin combination therapies in Burkina Faso,2017,PLOS Global Public …,"… falciparum malaria. To explore how the increased adoption of ACTs may affect the HBHI malaria … artemisinin-resistant genotypes, such as pfkelch13 580Y, may occur under scenarios in …",Burkina Faso
523,"M l'Episcopia, C Doderer-Lang, E Perrotti, GB Priuli…",Polymorphism analysis of drug resistance markers in Plasmodium falciparum isolates from Benin,2017,Acta Tropica,"… resistance genotypes in the Pfkelch13, Pfcrt, Pfmdr1, dhfr and dhps genes in samples collected in Benin from patients who were tested positive for P. falciparum malaria by microscopy, …",Benin
526,"KB Beshir, N Diallo, FA Somé, S Sombie…",Persistent submicroscopic plasmodium falciparum parasitemia 72 hours after treatment with artemether-lumefantrine predicts 42-day treatment failure in Mali and …,2017,Antimicrobial agents …,… Surveillance of pfk13 genotypes across Africa has been carried out since the identification … falciparum harboring the R561H propeller domain variant of pfk13 was identified in Rwanda (…,Mali
529,"WR Taylor, P Olupot-Olupot…",… primaquine in children with glucose-6-phosphate dehydrogenase deficiency who are infected with Plasmodium falciparum in Uganda and the Democratic …,2017,The Lancet Infectious …,"… To close this knowledge gap, we conducted a study of single low-dose primaquine in children with uncomplicated falciparum malaria in Uganda and the Democratic Republic of the …",Uganda
533,"AN Wotodjo, MA Oboh, S Doucoure, N Diagne…","Rebound of multiple infections and prevalence of anti-malarial resistance associated markers following malaria upsurges in Dielmo village, Senegal, West …",2017,Malaria journal,"… in malaria deaths and admissions from severe malaria [7]. … ], has been recently detected in Rwanda and Uganda [10, 11]. … mutation in the pfkelch13 propeller domain (K13) has been …",Senegal
536,"RA Moussa, N Papa Mze, HY Arreh, AA Hamoud…",Molecular investigation of malaria-infected patients in Djibouti city (2018–2021),2017,Malaria journal,"… vivax in the general population of Ethiopia is over 8%, with … between Ethiopia and Djibouti [46], the evolution of the malaria … falciparum kelch 13 (Pfk13) gene associated with reduced …",Djibouti
540,"M Warsame, AA Osman, AH Hassan…",Current guidelines for malaria treatment in Somalia: evidence-based recommendations,2017,Somali Health Action …,"… falciparum K13 propeller (Pfk13), associated with artemisinin resistance, were investigated. The efficacy of artesunate-sulfadoxine/pyrimethamine, evaluated between 2003 and 2006 in …",Somalia
541,"A Signorell, P Awor, J Okitawutshu, A Tshefu…","… malaria treatment guidelines in the context of implementing pre-referral rectal artesunate in the Democratic Republic of the Congo, Nigeria, and Uganda: an …",2017,Plos …,"… falciparum harbouring artemisinin K13 resistance mutations was found in the context of the CARAMAL project in Uganda (Awor and colleagues, manuscript in preparation). …",Uganda
545,"K Kay, J Goodwin, H Ehrlich, J Ou…",Impact of Drug Exposure on Resistance Selection Following Artemether‐Lumefantrine Treatment for Malaria in Children With and Without HIV in Uganda,2017,Clinical …,"… Pfkelch13 mutations are widespread in Southeast Asia, and are now present in Rwanda and Uganda… Plasmodium falciparum chloroquine resistance transporter (pfcrt) and Plasmodium …",Uganda
548,"ENM Njagi, GO Orinda, K Thiongo, FT Kimani…",Clinical efficacy of artemisinin-lumefantrine and status of antifolate drug resistance markers in western Kenya,2017,,"… In Africa, limited mutation of K13 propeller were found in Dakar, Uganda, Mali [32–35]. In another study, pfkelch13, a gene located on chromosome 13 of P. falciparum and encoding K13…",Kenya
550,BK Asiimwe,Malaria drug resistance and associated diagnostic failures in arriving refugee children at Adjumani and Kyangwali reception centers in Uganda,2017,,… sequenced and analyzed for malaria drug resistance markers and … The prevalence of PfK13 mutations associated with … of resistance markers in Uganda. The PfHRP2 assay required a …,Uganda
554,"R Mwaiswelo, B Ngasala, JP Gil…","… cure rate of artemether–lumefantrine against uncomplicated Plasmodium falciparum malaria after 8 years of its wide-scale use in Bagamoyo District, Tanzania",2017,The American Journal …,"… falciparum parasite biology and probably its susceptibility to the drug have been changing. Plasmodium falciparum … 10 and it has been associated with Pfkelch13 mutations. In Africa, no …",Tanzania
562,"MG Chiduo, CI Mandara, SF Rumisha, F Chaky…",Assessing the intrinsic and extrinsic drivers and targeting the observed resilience of malaria in northwestern and southern Tanzania: A protocol for a cross-sectional …,2017,medRxiv,"… guide future studies and malaria surveillance in Tanzania and other malaria endemic countries. … falciparum kelch 13, k-13), partner drugs particularly lumefantrine and amodiaquine (P. …",Tanzania
570,"M Ocan, L Nakalembe, C Otike, W Nambatya, D Omali…",Prevalence of substandard quality artemetherlumefantrine antimalarial agents in Uganda,2017,,,Uganda
572,"KJ Marwa, ET Konje, A Kapesa, E Kamugisha…","… and dihydroartemisinin–piperaquine treatment outcomes among children infected with uncomplicated Plasmodium falciparum malaria in Mwanza, Tanzania",2017,Tropical Medicine and …,"… first line, respectively, in Tanzania. This study was carried in Igombe, Tanzania to assess the efficacies of ALU and DHP in routine treatment of uncomplicated malaria among children. …",Tanzania
574,"YD Ndiaye, W Wong, J Thwing, SS Schaffner, A Tine…",Two decades of molecular surveillance in Senegal reveal changes in known drug resistance mutations associated with historical drug use and seasonal malaria …,2017,medRxiv,"… Likewise, our limited surveillance of the Pfkelch13 limits our … levels of either Pfkelch13 C580Y or Pfkelch13 A578S in … the Pfkelch13 C439Y and A675Y mutations observed in Uganda 49…",Senegal
583,"F Gobbi, D Buonfrate, M Menegon, G Lunardi…",of dihydroartemisinin-piperaquine treatment of uncomplicated Plasmodium falciparum malaria in a traveller coming from Ethiopia,2018,,… Plasmodium falciparum dihydroartemisinin-piperaquine failures in Cambodia are associated with mutant K13 parasites presenting high survival rates in novel piperaquine in vitro …,Ethiopia
593,"A Njeru, J Mutiso, A Kimutai, EK Mibei","Performance of Rapid Immunochromatographic Test on Malaria Infecton Among Expectant Women in Kericho County, Kenya",2018,,"… tool in diagnosis of malaria among expectant women in Kericho County, Kenya. … sequences used for amplification of K13 propeller gene in nested PCR were K13-2 … K13-3 …",Kenya
597,M Ochan,Antimicrobial self medication in post conflict northern Uganda: Implications on chloroquine and artemisinin genotypic resistance in the community,2018,,… falciparum parasites are re-emerging in northern Uganda at a slow rate than that seen in other sub-Saharan countries. Non-synonymous mutation in K13-… in northern Uganda. Validation …,Uganda
601,"A Abamecha, D Yilma, W Addisu, H El-Abid, A Ibenthal…","Therapeutic efficacy of artemether-lumefantrine in the treatment of uncomplicated Plasmodium falciparum malaria in Chewaka District, Ethiopia",2018,Malaria Journal,"… mortality in Ethiopia [6]. According to the President’s malaria initiative Ethiopia malaria operational plan fiscal year 2018, 60–70% of the total projected numbers of malaria cases …",Ethiopia
602,"S Dama, H Niangaly, A Ouattara, I Sagara, S Sissoko…",Reduced ex vivo susceptibility of Plasmodium falciparum after oral artemether–lumefantrine treatment in Mali,2018,Malaria journal,… falciparum Kelch 13 (pfK13) polymorphisms to be associated with delayed parasite … in the pfK13 gene were associated with delayed clearance of P. falciparum following artemisinin …,Mali
603,NF Kane,"Effect of extracts of Artemisia afra collected from five different regions in Africa (Kenya, Burundi, Tanzania, South Africa and Senegal) on in vitro and in vivo …",2018,Pan African University,"… falciparum Kelch13 (Pfk13) gene provide resistance to ART. Artemisinin resistance was reported first in western Cambodia, (Dondorp et al., 2009; Noedl et al., 2008; Elizabeth et al., …","Kenya, Burundi, Tanzania, South Africa, Senegal"
607,"A Yeka, R Kigozi, MD Conrad…",Artesunate/amodiaquine versus artemether/lumefantrine for the treatment of uncomplicated malaria in Uganda: a randomized trial,2018,The Journal of …,"… 6–59 months with uncomplicated falciparum malaria from 3 health … Drug safety and tolerability and Plasmodium falciparum … Of note, key polymorphisms in the K13 gene [38] and other …",Uganda
614,"VP de Santi, BA Khaireh, T Chiniard…","Role of Anopheles stephensi mosquitoes in malaria outbreak, Djibouti, 2019",2018,Emerging infectious …,… We did not observe any mutations in the K13 propeller region (… therapy potentially caused by K13 mutations observed in … have been observed in Sudan and Ethiopia (13). Our study …,Djibouti
628,KK Wamae,"Genetic Epidemiology of Plasmodium falciparum Asymptomatic Infections and Antimalarial Drug-resistance Markers in Kilifi, Kenya.",2018,,"… drug resistance markers, none of kelch 13 (k13) validated markers of artemisinin resistance were detected in the population, nonetheless, a single k13 allele, K189T, was maintained at …",Kenya
631,"G Staedke, B Greenhouse, SL Nsobya, MR Kamya…",Changing antimalarial drug resistance patterns identified by surveillance at three sites in Uganda 2,2018,core.ac.uk,"… falciparum drug resistance markers in parasites collected in 2012, 40 2013, and 2015 at 3 sites in Uganda. The … We identified a handful of K13 202 propeller domain mutations, but no …",Uganda
632,"A Shayo, J Buza, DS Ishengoma",… -based anti-malarials for treatment of uncomplicated malaria: a review of evidence of implementation of anti-malarial therapeutic efficacy trials in Tanzania,2018,Malaria journal,"… ACT is efficacious and safe for treatment of uncomplicated malaria in Tanzania. However, few trials were conducted in Tanzania before and after policy changes in 2006 and thus more …",Tanzania
634,World Health Organization,"Report on the sixth intercountry meeting of national malaria control programme managers from HANMAT and PIAM-Net countries, Cairo, Egypt, 13-14 August …",2018,,"… K13 artemisinin resistance multicentre rapid assessment (KARMA) project to describe the geographical distribution of K13 alleles in malaria-… Somalia, together with the national malaria …",Egypt
636,"A Uwimana, E Legrand, BH Stokes, JL Ndikumana…","… A, Menard D. 2020. Emergence and clonal expansion of in vitro artemisinin-resistant Plasmodium falciparum kelch13 R561H mutant parasites in Rwanda",2018,Nat Med,,Rwanda
645,"M Ocan, R Bakubi, M Tayebwa, J Basemera…",Experiences of healthcare personnel on the efficacy of artemisinin-based combination therapies and malaria diagnosis in hospitals in Uganda,2018,,… personnel on malaria diagnosis and self-reported e cacy of ACTs in management of malaria symptomatic patients in hospitals in low and high malaria transmission settings in Uganda. …,Uganda
655,"AH Beavogui, A Camara, A Delamou, MS Diallo…","Efficacy and safety of artesunate–amodiaquine and artemether–lumefantrine and prevalence of molecular markers associated with resistance, Guinea: an …",2018,Malaria Journal,"… Tanzania, a study assessing the efficacy and safety of AL for the treatment of uncomplicated Plasmodium falciparum malaria … and no known artemisinin resistance pfk13 mutations [11]. …",Guinea
661,"N Brown, C da Silva, C Webb, D Matias…",Antimalarial resistance risk in Mozambique detected by a novel quadruplex droplet digital PCR assay,2018,Antimicrobial Agents …,"… falciparum malaria parasite continues to cause severe disease globally, Mozambique is disproportionally represented in malaria … did not detect validated mutations in pfkelch13 (31), the …",Mozambique
663,"PTN Niba, AM Nji, MS Evehe, IM Ali, PM Netongo…",Drug resistance markers within an evolving efficacy of anti-malarial drugs in Cameroon: a systematic review and meta-analysis protocol,2018,,… k13-propeller gene and a near complete return of chloroquine susceptible falciparum malaria in Southeast of Tanzania… falciparum kelch13 R561H mutant parasites in Rwanda. Nat Med […,Cameroon
664,"B Makena, V Mobegi, M Nginya…",Genetic Diversity of Plasmodium falciparum Parasites in Pregnant and Non-pregnant Women and Potential Resistance to Antimalarial Drugs in Kenya,2018,Open Res …,"… efficacy study in Ahero, Kenya. All samples were diagnosed for malaria using 18s rRNA rtPCR. … Single nucleotide polymorphisms genotyping for K13, Pfmdr1, Pfdhfr, Pfdhps, and Pfcrt …",Kenya
669,"C Namayanja, EEI Eregu, P Ongodia, CB Okalebo…",Unusual clinical spectra of childhood severe malaria during malaria epidemic in eastern Uganda: a prospective study,2018,Malaria Journal,"… In addition, the recent emergence of independent malaria drug resistance in Rwanda [13], Tanzania [14], and Uganda [15] has caused challenges in malaria control using artemisinin-…",Uganda
673,"G Zhou, HS Taffese, D Zhong, X Wang, MC Lee…",Resurgence of Clinical Malaria in Ethiopia and Its Link to Anopheles stephensi Invasion,2018,Pathogens,"… gaps in malaria control in Ethiopia from 2001 to 2022, to assess the changes in malaria … outbreaks include but are not limited to the possible K13 gene mutation related antimalarial …",Ethiopia
676,"AMA Bakhiet, MH Abdelraheem, A Kheir…",Evolution of Plasmodium falciparum drug resistance genes following artemisinin combination therapy in Sudan,2018,Transactions of The …,"… the Pfk13 propeller domain that correlate with slow artesunate clearance of P. falciparum in … in the neighbouring countries of Kenya and Uganda. However, the recent switch of first-line …",Sudan
679,"SA Matrevi, T Adams, KZ Tandoh…",Putative molecular markers of Plasmodium falciparum resistance to antimalarial drugs in malaria parasites from Ghana,2018,Frontiers in …,"… falciparum genome revealed mutations in the kelch propeller gene (pfk13) to be associated with the … This observation is similar to studies carried out in Uganda and Kenya (27, 28). The …",Ghana
686,"CB Osoro, S Dellicour, E Ochodo, T Young…",… and drug dispenser practices for the treatment of malaria in pregnancy in the context of multiple first-line therapies in western Kenya: a qualitative study,2018,Malaria Journal,"… In 2013, a study in Kenya’s Lake endemic zone reported correct malaria case management practice in pregnancy in only 45% of health facilities and 31% of drug outlets [11]. In the …",Kenya
690,"C Fançony, M Brito, JP Gil",Plasmodium falciparum drug resistance in Angola,2018,Malaria journal,"… K13-propeller gene polymorphisms, a recent study have performed a small survey which consisted of 100 uncomplicated malaria … parasites carried wild-type k13-propeller genes [58]. …",Angola
693,"C Lengeler, C Burri, P Awor, P Athieno…","… to rectal artesunate for malaria (CARAMAL): a large-scale observational implementation study in the Democratic Republic of the Congo, Nigeria and Uganda",2018,PLOS Global Public …,… malaria in the frame of the PSS at two time points (see Fig 4 above) to measure the prevalence of molecular markers of artemisinin resistance (K13-… in Phnom Pen for K13 genotyping. …,Uganda
705,"J Straimer, P Gandhi, K Csermak Renner, EK Schmitt",High prevalence of P. falciparum K13 mutations in Rwanda is associated with slow parasite clearance after treatment with artemether–lumefantrine,2018,J Infect Dis,,Rwanda
719,"JF Namuganga, JI Nankabirwa…",East Africa International Center of Excellence for Malaria Research: Impact on Malaria Policy in Uganda,2018,The American journal …,"… We have seen increasing prevalence of two K13 propeller domain mutations (469Y and 675V), which were associated with artemisinin resistance in southeast Asia, in parasites …",Uganda
729,"ENM Njagi, GO Orinda, FT Kimani, K Thiongo…",Efficacy of Artemisinin-lumefantrine for the treatment of uncomplicated malaria after more than a decade after its use in Kenya,2018,,… E cacy and safety of artemetherlumefantrine for the treatment of uncomplicated malaria and prevalence of Pfk13 and Pfmdr1 polymorphisms after a decade of using artemisinin-based …,Kenya
