,Authors,Title,Year,Source,Abstract,countries
189,"SY Ahorhorlu, NB Quashie, RW Jensen, W Kudzi…",Assessment of artemisinin tolerance in Plasmodium falciparum clinical isolates in children with uncomplicated malaria in Ghana,2015,Malaria Journal,"… Rwanda, and Uganda, have revealed a recent independent emergence of partial ART resistance with the observation of increased number of isolates with confirmed Pfk13 … in the Pfk13 …",Ghana
203,"J Hassen, GS Alemayehu, H Dinka, L Golassa","… of Pfcrt 76T and Pfmdr1 N86 genotypes in malaria infected patients attending health facilities in East Shewa zone, Oromia Regional State, Ethiopia",2016,Malaria Journal,"… of falciparum malaria for more than two decades in Ethiopia, greater proportions of P. falciparum … may be favoured by the use of AL for the treatment of uncomplicated falciparum malaria. …",Ethiopia
212,"MD Conrad, D Mota, M Foster…",Impact of Intermittent Preventive Treatment During Pregnancy on Plasmodium falciparum Drug Resistance–Mediating Polymorphisms in Uganda,2016,The Journal of …,"… malaria with DP in Cambodia [23, 24]. These failures were associated with mutations in the propeller domain of the pfkelch13 … In Uganda, the efficacy of DP for the treatment of malaria …",Uganda
214,V Asua,PA-285 Plasmodium falciparum antimalarial drug resistance: population-based spatio-temporal evolutionary trends in Uganda,2016,,"… falciparum Kelch-13 protein that are associated with artemisinin partial resistance. … for malaria using microscopy, RDT and PCR, from enrolment to delivery. Positive malaria parasite …",Uganda
215,"V Asua, MD Conrad, O Aydemir…","Changing prevalence of potential mediators of aminoquinoline, antifolate, and artemisinin resistance across Uganda",2016,The Journal of …,"… to represent varied malaria epidemiology across Uganda (Figure 1)… First, in Rwanda, a PfK13 mutation previously associated … emergence in northern Uganda of another PfK13 mutation, …",Uganda
221,"IM Laminou, I Issa, E Adehossi, K Maman, H Jackou…","Therapeutic efficacy and tolerability of artemether–lumefantrine for uncomplicated Plasmodium falciparum malaria in Niger, 2020",2016,Malaria Journal,… The study findings indicate that AL is effective and well tolerated for the treatment of uncomplicated malaria in three sites in Niger. The emergence of a pfk13 mutation requires …,Niger
223,"BE Ngasala, MG Chiduo, BP Mmbando, FT Francis…","Efficacy and safety of artemether-lumefantrine for the treatment of uncomplicated falciparum malaria in mainland Tanzania, 2019",2016,Malaria journal,"… In this study, 10 pfk13 mutations were … Rwanda, the first report of locally arising pfk13 mutations in Africa, without affecting the efficacy of AL [15]. From the mutations reported in Rwanda, …",Tanzania
228,"RJ Zupko, TD Nguyen, JCS Ngabonziza, M Kabera…",Modeling policy interventions for slowing the spread of artemisinin-resistant pfkelch R561H mutations in Rwanda,2016,Nature Medicine,"… uncomplicated Plasmodium falciparum malaria, but the emergence of the new pfkelch13 R561H mutation in Rwanda, … Using a Rwanda-specific spatial calibration of an individual-based …",Rwanda
233,"F Gobbi, D Buonfrate, M Menegon, G Lunardi…",Failure of dihydroartemisinin-piperaquine treatment of uncomplicated Plasmodium falciparum malaria in a traveller coming from Ethiopia,2016,Malaria Journal,"… against uncomplicated Plasmodium falciparum malaria. Despite the success of ACT in reducing the global burden of malaria, the emerging of resistance to artemisinin threatens its use. …",Ethiopia
235,"C Karema, S Wen, A Sidibe, JL Smith, R Gosling…",History of malaria control in Rwanda: implications for future elimination in Rwanda and other malaria-endemic countries,2016,Malaria journal,"… to investigate the presence of k13 polymorphisms. No … In 2015, two isolates showed candidate k13 resistance … -confirmed k13 mutations reported (1–20% prevalence of k13 561H), a …","Rwanda, Rwanda"
236,"V Asua, J Vinden, MD Conrad, J Legac…",Changing molecular markers of antimalarial drug sensitivity across Uganda,2016,Antimicrobial Agents …,"… We found low prevalence of K13 propeller domain mutations, which are associated with … In Uganda, the standard therapy for uncomplicated malaria changed from chloroquine to …",Uganda
239,"DA Beyene, CK Kibet, T Degefa, L Amenga-Etego…",Genomic analysis reveals independent evolution of Plasmodium falciparum populations in Ethiopia,2016,,"… gene ow between Ethiopia and its neighbors is the local malaria … falciparum malaria in Ethiopia, we explored the mechanisms … We reported no PfKelch13 validated mutations in Ethiopia, …",Ethiopia
240,J Andersson,"Monitoring of Artemisinin Combination Therapy in Igombe, Tanzania.",2016,,"… the K13 kelch protein, also known as the ‘K13 propeller’. In this study data from 38 malaria patients in Igombe, Tanzania, … of variation inside the K13 domain in the malaria parasites was …",Tanzania
243,"AO Achieng, P Muiruri, LA Ingasia, BH Opot…",… of Plasmodium falciparum molecular markers selected for by artemether–lumefantrine treatment in pre-ACT and post-ACT parasites in western Kenya,2016,International Journal for …,"… Although AL remains highly efficacious and K13 polymorphisms are not associated with reduced susceptibility to ACTs in SSA, AL is associated with selection of single nucleotide …",Kenya
248,"AO Idowu, WA Oyibo, S Bhattacharyya, M Khubbar…",Rare mutations in Pfmdr1 gene of Plasmodium falciparum detected in clinical isolates from patients treated with anti-malarial drug in Nigeria,2016,Malaria journal,"… falciparum kelch 13 (Pfk13) genes, which have been … in the therapy of malaria by the Nigeria malaria control programme in … This is consistent with findings in Ethiopia which identified the …",Nigeria
251,"H Mbye, K Mane, MF Diop, MA Demba…","Plasmodium falciparum merozoite invasion ligands, linked antimalarial resistance loci and ex vivo responses to antimalarials in The Gambia",2016,Journal of …,… The malaria parasite Plasmodium falciparum has adapted to … Current treatment for uncomplicated malaria therefore requires … falciparum kelch13 R561H mutant parasites in Rwanda …,Gambia
257,"P Awor, N Khim, R Coppée, L Rondepierre, C Roesch…",Clonal expansion of artemisinin-resistant Plasmodium falciparum in Uganda is associated with substandard treatment practices,2016,,"… Rectal Artesunate for Malaria project, blood samples were collected from children with signs of severe malaria before and after RAS implementation. K13 polymorphisms were assessed …",Uganda
261,"C Escobar, S Pateira, E Lobo, L Lobo, R Teodosio…",Polymorphisms in Plasmodium falciparum K13-Propeller in Angola and Mozambique after the Introduction of the ACTs,2016,PloS one,"… falciparum K13-propeller gene in two African countries, Angola and Mozambique, where malaria is … V494I is adjacent to the known K13 resistance-associated mutation Y493H, although …",Angola
262,"A Assefa, H Mohammed, A Anand, A Abera, H Sime…",… of uncomplicated Plasmodium falciparum and chloroquine and dihydroartemisinin-piperaquine for uncomplicated Plasmodium vivax infection in Ethiopia,2016,Malaria Journal,"… falciparum samples sequenced for the PfK13 gene, none had a mutation associated with artemisinin resistance. These results were in contrast with previous studies that showed the …",Ethiopia
267,"A Holzschuh, A Lerch, I Gerlovina, BS Fakih…","Multiplexed ddPCR-amplicon sequencing reveals isolated Plasmodium falciparum populations amenable to local elimination in Zanzibar, Tanzania",2016,Nature …,"… Lastly, Zanzibar is highly connected to mainland Tanzania where malaria transmission … mutations in the pfk13 gene found in Rwanda, Uganda, and mainland Tanzania were not …",Tanzania
269,"M Tola, O Ajibola, ET Idowu, O Omidiji, ST Awolola…","Molecular detection of drug resistant polymorphisms in Plasmodium falciparum isolates from Southwest, Nigeria",2016,BMC research …,"… falciparum positive by PCR, we carried out gene expression, detecting only wild type Pfk13 … has been reported across many malaria endemic regions; in China [24], Tanzania [25], …",Nigeria
270,"RJ Zupko, TD Nguyen, JCS Ngabonziza, M Kabera…",Potential policy interventions for slowing the spread of artemisinin-resistant pfkelch R561H mutations in Rwanda,2016,medRxiv,"… falciparum malaria. However, the emergence of a novel pfkelch13 R561H mutation in Rwanda, … calibrated and validated for the Rwanda’s malaria epidemiology, we evaluate seventeen …",Rwanda
272,"B Ngasala, S Bushukatale, M Chiduo, T Makene…",Efficacy of artesunate-amodiaquine for treatment of uncomplicated Plasmodium falciparum malaria in mainland Tanzania,2016,Malaria Journal,"… falciparum kelch-propeller gene at chromosome 13 (Pfk13) [19]. The partial resistance is characterized by prolonged clearance of the asexual parasites after treatment-initiation, leaving …",Tanzania
285,"VS Koko, M Warsame, B Vonhm, MK Jeuronlon…",Artesunate–amodiaquine and artemether–lumefantrine for the treatment of uncomplicated falciparum malaria in Liberia: in vivo efficacy and frequency of …,2016,Malaria Journal,… falciparum kelch13 (Pfkelch13) gene have been demonstrated to be a major determinant … of indigenous Pfkelch13 mutants (R561H in Rwanda and A675V and C469Y in Uganda) …,Liberia
287,"K Gubae, H Mohammed, H Sime, H Hailgiorgis…","… efficacy of artemether-lumefantrine in the treatment of uncomplicated Plasmodium falciparum malaria at Shecha health centre, Arba Minch, Ethiopia",2016,Malaria Journal,… falciparum malaria in Ethiopia. Periodic therapeutic efficacy studies and monitoring of markers of resistance are recommended for early detection of resistant parasites. …,Ethiopia
289,"M Ocan, L Nakalembe, C Otike, D Omali, A Buzibye…",Pharmacopeial quality of artemether–lumefantrine anti-malarial agents in Uganda,2016,Malaria Journal,… Other studies also confirmed presence of K13 molecular markers of artemisinin resistance among P. falciparum parasites across the country [28] and in Rwanda [29]. Since its …,Uganda
295,"D Zhao, H Zhang, P Ji, S Li, C Yang, Y Liu…","Surveillance of Antimalarial Drug-Resistance Genes in Imported Plasmodium falciparum Isolates From Nigeria in Henan, China, 2012–2019",2016,Frontiers in cellular …,"… The polymorphism of the Kelch 13 (K13) propeller domain in P. falciparum has been … However, the validated PfK13 R561H mutation recently observed in Rwanda has substantial …",Nigeria
299,"G Tadele, A Jawara, M Oboh, E Oriero, S Dugassa…",… of uncomplicated falciparum malaria from high and low malaria transmission areas show distinct pfcrt and pfmdr1 polymorphisms in western Ethiopia,2016,Malaria Journal,"… alter malaria parasite … falciparum malaria, pfcrt haplotype, and pfmdr1 single nucleotide polymorphisms (SNPs) were determined in two sites of West Ethiopia with a gradient of malaria …",Ethiopia
300,"CI Mandara, RA Kavishe, S Gesase, J Mghamba…","… –lumefantrine and dihydroartemisinin–piperaquine for the treatment of uncomplicated falciparum malaria in Muheza and Kigoma Districts, Tanzania",2016,Malaria journal,"… the known mutations in the kelcher 13 (k-13) gene associated with artemisinin resistance in … efficacy and parasite clearance of ACT, and surveillance of polymorphism in the k-13 gene. …",Tanzania
302,"B Andagalu, OJ Watson, I Onyango…",Malaria transmission Dynamics in a high-transmission setting of western Kenya and the inadequate treatment response to artemether-lumefantrine in an …,2016,Clinical Infectious …,… Assessing the infectious reservoir is critical in malaria control and elimination strategies. We conducted a longitudinal epidemiological study in a high-malaria-burden region in Kenya to …,Kenya
305,"LE Mhamilawa, B Ngasala, U Morris, EN Kitabi…","… –lumefantrine and a single low-dose primaquine for uncomplicated Plasmodium falciparum malaria in Bagamoyo district, Tanzania: a randomized controlled …",2016,Malaria journal,"… falciparum kelch 13 propeller gene (pfk13) [7, 9,10,11,12]. Such mutations have recently been documented in Rwanda, in the first report of locally arising pfk13 mutations in Africa, …",Tanzania
306,"X Wang, X Zhang, H Chen, J Zhang, Q Lu…",Molecular epidemiology of drug resistance genes in plasmodium falciparum isolates imported from Nigeria between 2016 and 2020: continued emergence of fully …,2016,Microbiology …,"… falciparum k13 markers and 11 candidate markers of partial … mutant parasites were detected in Rwanda in 2014, which … falciparum k13 R561H mutant parasites in Rwanda (8), it is …",Nigeria
315,"E Coonahan, H Gage, D Chen, EV Noormahomed…",Whole-genome surveillance identifies markers of Plasmodium falciparum drug resistance and novel genomic regions under selection in Mozambique,2016,Mbio,… pfkelch13 (PF3D7_1343700) nor evidence of artemisinin resistance conferring mutations in pfkelch13. … conferring mutations in pfkelch13 have recently been reported in Rwanda and …,Mozambique
330,"YQ Liu, XY Liang, J Li, JT Chen, HY Huang…","Molecular surveillance of artemisinin-based combination therapies resistance in Plasmodium falciparum parasites from Bioko Island, Equatorial Guinea",2016,Microbiology …,"… , haplotype network, and effect of natural selection of the Pfk13 gene were evaluated. This might contribute to the subsequent treatment of malaria patients and malaria control. …",Equatorial Guinea
338,"CM Dentinger, TA Rakotomanga, A Rakotondrandriana…","Efficacy of artesunate-amodiaquine and artemether-lumefantrine for uncomplicated Plasmodium falciparum malaria in Madagascar, 2018",2016,Malaria Journal,"… No pfk13 … in Rwanda harbouring a pfk13 mutation, R561H, with associated delayed clearance after treatment with AL underscores the importance of continued monitoring for pfk13 …",Madagascar
339,"P Tumwebaze, S Tukwasibwe, A Taylor…",Changing antimalarial drug resistance patterns identified by surveillance at three sites in Uganda,2016,The Journal of …,"… falciparum drug resistance markers in parasites collected in 2012, 2013, and 2015 at 3 sites in Uganda. … We identified a handful of K13 propeller domain mutations but no evidence of …",Uganda
345,"DA Petro, N Shaban, S Aaron, F Chacky…","Geospatial analysis of malaria burden in Kagera region, northwestern Tanzania using health facility and community survey data",2016,Open Forum …,… -resistant Plasmodium falciparum kelch13 R561H mutant parasites in Rwanda. Nat Med. … Plasmodium falciparum kelch13 R561H genotypes with delayed parasite clearance in Rwanda…,Tanzania
347,"E Mazigo, H Jun, WJ Lee, JM Louis, F Fatriana…",Asymptomatic Malaria Infections: A Hidden Reservoir for Transmission and Circulation of Artemisinin Resistance of Plasmodium Falciparum in Tanzania,2016,papers.ssrn.com,"… sequenced at pfk13 and pfmdr1 … malaria cases in Tanzania. Currently, studies have 87 reported on the circulation of artemisinin partial resistance in clinical malaria cases in Tanzania. …",Tanzania
349,"G Makenga, V Baraka, F Francis, DTR Minja…",… risk factors for asymptomatic malaria and anaemia and their association with cognitive and psychomotor functions in schoolchildren of north-eastern Tanzania,2016,PLoS …,… falciparum gene encoding kelch-13 (Pfkelch-13) associated with prolonged parasite clearance time and other markers of partners drugs in the artemisinin-based combination therapy (…,Tanzania
352,"FO Maiga, M Wele, SM Toure, M Keita, CO Tangara…",Artemisinin-based combination therapy for uncomplicated Plasmodium falciparum malaria in Mali: a systematic review and meta-analysis,2016,Malaria Journal,"… observed in Rwanda, and the evaluation of additional anti-malarials in Rwanda has been … de novo emergence of Pfkelch13-mediated resistance in Rwanda, potentially compromising …",Mali
355,"Y Diarra, O Koné, L Sangaré, L Doumbia, DBB Haidara…","… efficacy of artemether–lumefantrine and artesunate–amodiaquine for the treatment of uncomplicated Plasmodium falciparum malaria in Mali, 2015–2016",2016,Malaria Journal,"… Guyana [7] and recently reported in Rwanda [8]. Although artemisinin … falciparum kelch 13 (Pfk13) gene are associated with … To date, there have been no reports of Pfk13 polymorphisms …",Mali
356,"MN Pouye, G Diop, C Derbois, B Mbengue, O Ka…",Genetic architecture and dynamics of PfKelch13'sp ropeller domain in 1 Plasmodium falciparum clinical isolates collected in Senegal. 2,2016,,Genetic architecture and dynamics of PfKelch13’s propeller domain in 1 Plasmodium falciparum clinical isolates collected in Se Page 1 Genetic architecture and dynamics of PfKelch13’…,Senegal
357,M Triunfol,Concerns over stable artemisinin resistance in Uganda,2016,The Lancet Infectious Diseases,"… initially in Rwanda and subsequently in areas with high malaria transmission rates in Uganda. … “Back in 2018, when we started sequencing the PfK13 gene, we found only two mutations …",Uganda
358,"BA Mensah, O Aydemir, JL Myers-Hansen…",Antimalarial drug resistance profiling of Plasmodium falciparum infections in Ghana using molecular inversion probes and next-generation sequencing,2016,Antimicrobial agents …,"… falciparum genes (pfcrt, pfmdr1, pfdhps, pfdhfr, and pfk13) … However, the pfK13 C580Y mutant has independently … pfK13 561H has also emerged independently in Rwanda (30). …",Ghana
364,"DS Ishengoma, CI Mandara, RA Madebe, M Warsame…",… reveal high polymorphism and high potential for use in anti-malarial efficacy studies in areas with different transmission intensities in mainland Tanzania,2016,Malaria Journal,"… falciparum malaria [4]. However, recent studies showed confirmed ART-R in Rwanda with mutations at codon R561H (> 5%) of the k13 … in Uganda with mutations in the k13 gene at …",Tanzania
365,"G Makenga, MD Seth, V Baraka, BP Mmbando…",… of intermittent preventive treatment for malaria using dihydroartemisinin-piperaquine on reducing malaria burden in school-aged children in Tanzania …,2016,Malaria Journal,"… Intermittent Preventive Treatment of malaria in … Region, Tanzania so as to understand the operational feasibility and effectiveness of IPTsc on malaria parasitaemia and clinical malaria …",Tanzania
369,"A Holzschuh, Y Ewnetu, L Carlier, A Lerch…",Plasmodium falciparum transmission in the highlands of Ethiopia is driven by closely related and clonal parasites,2017,Molecular …,"… conducted in Ethiopia (Emiru et al., 2023; Fola et al., 2023) and Eritrea (Mihreteab et al., 2023) have identified P. falciparum parasites carrying a novel mutation (R622I) in the k13 gene …",Ethiopia
371,"SS Mandai, F Francis, DP Challe, MD Seth…","… asymptomatic individuals from villages with high prevalence of artemisinin partial resistance in Kyerwa district of Kagera region, north-western Tanzania",2017,Malaria Journal,"… Uganda, with an average prevalence of Kelch 13 R561H mutation of 7.7% among symptomatic patients and a high prevalence in Karagwe (22.8%) and Kyerwa district (14.4%) [29, 30]. …",Tanzania
373,AO Idowu,"Antimalarial resistance genes polymorphism and imunoendocrine biomarker profile in patients with uncomplicated plasmodium falciparum malaria in Lagos, Nigeria",2017,,"… Pfk13) that have been previously associated with antimalarial resistance. Amplification and sequencing of the Pfk13, … The NGS method detected three Pfk13, seven Pfcrt, and six Pfmdr1 …",Nigeria
378,"DA Petro, N Shaban, S Aaron, F Chacky, S Lazaro…","Geospatial analysis and mapping of malaria burden in Kagera region, northwestern Tanzania using routine health facility and community survey data",2017,medRxiv,"… in Tanzania (MSMT) reported a focus in Kagera region only, with high genotype frequency of parasites with mutations in Kelch13 gene (K13) (genotype frequency of 0.077, and as high …",Tanzania
380,"PTN Niba, AM Nji, MS Evehe, IM Ali, PM Netongo…",Drug resistance markers within an evolving efficacy of anti-malarial drugs in Cameroon: a systematic review and meta-analysis (1998–2020),2017,Malaria Journal,"… In Africa, the Pfk13 mutation with the highest geographical … has recently been reported in Tanzania [32] and Rwanda [33]. Hence, … falciparum samples genotyped and most of Pfk13 gene …",Cameroon
384,"A Heuchert, N Abduselam, A Zeynudin, T Eshetu…",Molecular markers of anti-malarial drug resistance in southwest Ethiopia over time: regional surveillance from 2006 to 2013,2017,Malaria journal,"… collected on filter paper from microscopically malaria positive patients in Jimma zone (District), southwestern Ethiopia. Plasmodium falciparum, Plasmodium vivax and mixed infections …",Ethiopia
388,MK Angwe,"Artemether-Lumefantrine Plasmodium Falciparum clearance and associated factors among uncomplicated Malaria patients in Adjumani District, Uganda",2017,,… falciparum K13-propeller gene was detected in 15 of the 80 samples sequenced. The K13 … increase in the prevalence of Day 3 Plasmodium falciparum in AL-treated patients. Parasite …,Uganda
389,"V Baraka, HM Mavoko, C Nabasumba, F Francis…",… -amodiaquine on selection of Plasmodium falciparum multidrug resistance gene-1 polymorphisms in the Democratic Republic of Congo and Uganda,2017,PLoS …,… in clinical the coast of Kenya and report of imported malaria cases isolated from UK based … limited dispersal of parasites strains carrying Pfkelch-13 key mutations in Africa settings and …,Uganda
390,"C da Silva, S Boene, D Datta…",Targeted and whole-genome sequencing reveal a north-south divide in P. falciparum drug resistance markers and genetic structure in Mozambique,2017,Communications …,"… , the validated pfkelch13 mutation R561H has been detected in Rwanda 9 and Tanzania 10 , … C469Y have been associated with prolonged parasite clearance half-lives in Uganda 11 . …",Mozambique
408,"G Makenga, V Baraka, F Francis, S Nakato…",… or artesunate-amodiaquine in reducing malaria related morbidities and improving cognitive ability in school-aged children in Tanzania: A study protocol for a …,2017,Contemporary Clinical …,… a substantial reservoir for malaria transmission. Asymptomatic … conducted in north-eastern Tanzania to expand the IPT by … (ASAQ) in preventing malaria related morbidities in school-…,Tanzania
414,"AR Taylor, JA Flegg, CC Holmes…",… -Lumefantrine and Dihydroartemisinin-Piperaquine Exert Inverse Selective Pressure on Plasmodium Falciparum Drug Sensitivity-Associated Haplotypes in Uganda,2017,Open Forum …,"… AL and DP to treat uncomplicated P falciparum malaria in Tororo, Uganda from 2007 to 2012. We regressed estimates onto covariates of trial arm and selective drug pressure. …",Uganda
415,"PR Dimbu, R Horth, ALM Cândido…",Continued low efficacy of artemether-lumefantrine in Angola in 2019,2017,Antimicrobial agents …,"… Samples from treatment failures were genotyped for the pfk13… Plasmodium falciparum, and the cornerstone of malaria case … emergence of artemisinin resistance in Rwanda (4). To …",Angola
416,"JN Maniga, M Rael, P Bwogo, I Ntulume, J Tibyangye…","In-vivo efficacy profiles of plasmodium falciparum to Artemether-Lumefantrine, the recommended first-line treatment of uncomplicated Malaria in Kisii County Kenya",2017,,"… Stokes BH, Rubiano K, Dhingra SK, Mok S, Straimer J, Ross LS, Legrand E, Ariey F, Cunningham CH, Issa MPfalciparum K13 mutations present varying degrees of artemisinin …",Kenya
417,"AJ Adegbola, L Ndwiga, K Wamae, V Osoti…","ONT sequencing identifies a high prevalence of crt sensitive, triple mutant dhfr and single mutant dhps parasites within an ANC population in Nigeria",2017,Frontiers in …,"… falciparum malaria. These interventions have helped to alleviate the risk associated with malaria … Our findings suggest that k13 mutations are not widespread in Nigeria, and even where …",Nigeria
418,"LF Moriarty, PM Nkoli, JL Likwela…",Therapeutic efficacy of artemisinin-based combination therapies in Democratic Republic of the Congo and investigation of molecular markers of antimalarial …,2017,American Journal of …,… falciparum parasites. Specific polymorphisms in the propeller domain of the pfkelch13 (pfk13) gene… falciparum kelch13 R561H mutant parasites in Rwanda. Nat Med 26: 1602-1608. 10. …,Congo
419,"MC Igwe, A Ogbonna","Prevalence of Antimalaria-Drug-Resistant Plasmodium-Falciparum Mutant Genes in Out-Patients from a Malaria Endemic in Western Region, Uganda",2017,researchgate.net,Several studies have been conducted to assess the prevalence of antimalaria drug resistance in Uganda and other malaria-endemic regions. We reviewed work often involve molecular …,Uganda
420,"R Mwaiswelo, B Ngasala, I Jovel, W Xu…","… Plasmodium falciparum positivity on Day 3 after initiation of artemether–lumefantrine treatment for uncomplicated malaria in Bagamoyo District, Tanzania",2017,The American Journal …,"… In Africa, despite recent case reports of suspected resistance, 9 , 10 Pfk13 polymorphisms are rare and do not include those previously described and associated with delayed P. …",Tanzania
423,"M Tesfaye, A Assefa, H Hailgiorgis, B Gidey…","Therapeutic efficacy and safety of artemether-lumefantrine for uncomplicated Plasmodium falciparum malaria treatment in Metehara, Central-east Ethiopia",2017,Malaria Journal,"… Ethiopia has developed a strategic plan for malaria from 2021 to 2025, which has been … reviewing its malaria program and making progress towards eliminating malaria in areas with …",Ethiopia
