,Authors,Title,Year,Source,Abstract,countries
1260,"PK Yang, XY Liang, M Lin, JT Chen, HY Huang, LY Lin…",Population genetic analysis of the Plasmodium falciparum erythrocyte binding antigen-175 (EBA-175) gene in Equatorial Guinea,2020,Malaria Journal,"… falciparum malaria cases confirmed by microscopic examination and lateral flow test kit (ICT … falciparum isolated from Asia or South America was less correlation (Additional file 5), …",Equatorial Guinea
1262,"I Molina-de la Fuente, MA Pacheco, L García…",Evolution of pfhrp2 and pfhrp3 deletions in Equatorial Guinea between the pre– and post–RDT introduction,2020,Malaria Journal,… Pfhrp2 and pfhrp3 deletions are threatening Plasmodium falciparum malaria diagnosis by rapid diagnostic tests (RDT) due to false negatives. This study assesses the changes in the …,Equatorial Guinea
1277,"GY Benjamin, HI Inabo, HID Muhammad, BO Olayinka","Genetic markers associated with antimalarial drug resistance and haemoglobin genotypes among malaria patients in Kaduna State, Nigeria",2020,,"… The 10 highest burden countries in Africa reported increases in cases of malaria in 2017 compared with 2016. Of these, Nigeria, Madagascar, and the Democratic Republic of Congo …",Nigeria
1340,"K Traoré, SAS Diakité, S Bah, DS Konaté, D Dabitao…","Ex-vivo Sensitivity of Plasmodium falciparum to Common Anti-malarial Drugs: The Case of Kéniéroba, a Malaria Endemic Village in Mali",2021,Drugs in R&D,"Background In 2006, the National Malaria Control Program in Mali recommended artemisinin-based combination therapy as the first-line treatment for uncomplicated malaria. Since the …",Mali
1361,"I Muhammad, PM Sale, M Khadija, TM Mahmoud…","Determining Molecular Markers Associated with Drug Resistance in DHFR and DHPS genes of Plasmodium falciparum from Gombe LGA Gombe State, Nigeria",2021,Int. J. Adv. Biol. Biomed …,… Local emergence in Amazonia of Plasmodium falciparum k13 C580Y mutants associated with in … molecular makers of Plasmodium falciparum isolates from Sudan during 2015–2017. …,Nigeria
1363,"A Coulibaly, MF Diop, A Kone, A Dara, A Ouattara…",Genome-wide SNP analysis of shows differentiation at drug-resistance-associated loci among malaria transmission settings in southern Mali.,2021,Frontiers in genetics,,Mali
1364,"A Mayor, C da Silva, E Rovira-Vallbona…","… study to detect antimalarial drug resistance, gene deletions of diagnostic relevance and genetic diversity of Plasmodium falciparum in Mozambique: protocol",2021,BMJ open,"… —but not restricted to—markers of resistance to artemisinin [pfkelch13],37 SP [pfdhfr, pfdhps],… , a trilateral initiative to eliminate malaria from Mozambique, South Africa and Eswatini71 72…",Mozambique
1383,"ML Eberhard, E Ruiz-Tiben, DR Hopkins…",The peculiar epidemiology of dracunculiasis in Chad,2021,The American journal …,"… collected in Ghana and South Sudan. Preserved material of D. … v0.7.4 with indexing parameters “-k 13 -s 2” and mapping … in the Division of Parasitic Diseases and Malaria, CDC, for …",Chad
1392,"E Aninagyei, DM Puopelle, I Tukwarlba…",Molecular speciation of Plasmodium and multiplicity of P. falciparum infection in the Central region of Ghana,2021,PLOS Global Public …,"… Inability to detect the non-falciparum parasites for proper … the malaria parasite in Ghana is the microscopy and the malaria rapid … In 2017, another study in the Kwahu-South district in the …",Ghana
1398,"K Niaré, A Dara, I Sagara, MS Sissoko…",In vivo efficacy and parasite clearance of artesunate+ sulfadoxine–pyrimethamine versus artemether–lumefantrine in Mali,2021,The American journal …,… Mutations in the kelch 13 propeller domain have been … 57 km southwest of Bamako in the Sudan savanna area and 9 km away … from uncomplicated falciparum malaria were recruited. …,Mali
1432,"RD Kaaya, C Amour, JJ Matowo, FW Mosha…",Genetic Sequence Variation in the Plasmodium falciparum Histidine-Rich Protein 2 Gene from Field Isolates in Tanzania: Impact on Malaria Rapid Diagnosis,2021,Genes,"… There were approximately 348 million malaria rapid diagnostic test kits … falciparum lacking the hrp2/3 gene, enabling it to evade detection by HRP2-based RDTs. A study from Eritrea …",Tanzania
1434,"HB Ndagije, R Kiguba, L Manirakiza, E Kirabira…",Healthcare professionals' perspective can guide post-marketing surveillance of artemisinin-based combination therapy in Uganda,2021,Malaria Journal,… line for uncomplicated malaria and with cases of reports of resistance in South East Asia we … Non-synonymous propeller-region PfKelch 13 mutants associated with delayed clearance …,Uganda
1435,"K Kassaza, AC Long, JM McDaniels, M Andre…",Surveillance of Plasmodium falciparum pfcrt haplotypes in southwestern Uganda by high‐resolution melt analysis,2021,Malaria Journal,"… falciparum CQ resistance transporter (pfcrt). Following CQ withdrawal for anti-malarial treatment, studies across malaria-… types with reagents accessible in malaria-endemic countries. …",Uganda
1444,"M Safiyanu, AA Imam, AJ Alhassan, AY Manu…","Invitro senitivity profile of Plasmodium falcifarum clinical isolates to choloroquine and artemisin combination theraphy from Kano and Jigawa States, Nigeria",2021,Science World …,… north and the Guinea Savannah in the south. The state has the … Jigawa state is situated within the Sudan savannah vegetation … Emerging polymorphisms in falciparum Kelch 13 gene in …,Nigeria
1453,M Tambo,Population genetics and transmission dynamics of Plasmodium falciparum in the Kavango East and Zambezi regions of Namibia,2021,,"… with malaria control and elimination are; 1) a lack of comprehensive data including malaria … Nigeria, Madagascar and the Democratic Republic of the Congo had the highest estimated …",Namibia
1455,"U Mustapha, A Shehu, AS Ayuba, H Gomma…","Prevalence of multi drug resistance malaria among patients aged 0–14 years attending murtala muhammad specialist hospital Kano State, Nigeria",2021,International Journal of …,"… Plasmodium falciparum … malaria patients attending Murtala Muhammad Specialist Hospital, Kano, Nigeria. Samples from 100 children with malaria were examined to confirm the malaria …",Nigeria
1468,"V Shelus, N Mumbere, EM Mulogo…",Private sector antimalarial sales a decade after “test and treat”: A cross-sectional study of drug shop clients in rural Uganda,2021,Frontiers in Public …,"… Malaria remains a leading cause of death in low-income countries, … malaria in 2020, with 96% of deaths occurring in sub-Saharan Africa (3). In Uganda, Plasmodium falciparum malaria …",Uganda
1485,"S Mharakurwa, Z Matsena-Zingoni…",Steep Rebound of Chloroquine-Sensitive Plasmodium falciparum in Zimbabwe,2021,The Journal of …,… from national malaria formularies can lead to the reversion of resistant Plasmodium falciparum to wild-type. We report a steep decline in chloroquine-resistant P falciparum within 10 …,Zimbabwe
1498,"A Nsengimana, E Biracyaza, J Isimbi…",Request for Antimalarial Medicines and Their Dispensing Without a Prescription in Community Pharmacies in Rwanda,2021,Integrated Pharmacy …,"… , the Democratic Republic of Congo, Uganda, and … falciparum malaria in SSA involved the administration of chloroquine. Citation4 Since then, countries in which P. falciparum malaria …",Rwanda
1499,"A Nhama, L Nhamússua, E Macete, Q Bassat…","In vivo efficacy and safety of artemether–lumefantrine and amodiaquine–artesunate for uncomplicated Plasmodium falciparum malaria in Mozambique, 2018",2021,Malaria Journal,"… of malaria and 409,000 deaths from malaria occurred globally in 2019. The majority of malaria … Africa, where more than 71 million children aged 1–59 months had malaria in 2019 [1]. …",Mozambique
1510,P Hodoameda,Determination of Plasmodium Falciparum and Host Genetic Factors That Affect the Efficacy of the Artemisinin-Based Combination Partner Drugs Used in Ghana,2021,,"… Malaria is one … malaria treatment in disease-endemic areas. The ACT partner drugs in Ghana are lumefantrine (LUM), amodiaquine (AQ), and piperaquine (PQ). Plasmodium falciparum …",Ghana
1511,"MO Oniya, ET Obimakinde…","Prevalence of Antimalaria-Drug-Resistant-Plasmodium-falciparum Mutant Genes in Out-Patients from a Malaria Endemic Region in Southwest, Nigeria.",2021,Nigerian Journal of …,… falciparum to most malaria drugs used in the treatment of malaria in the study area. … to treatment regimens and therapeutics to aid the management of malaria in endemic areas. …,Nigeria
1519,"CP Nwibani, O Azuonwu, SD Abbey…","Assessment of Plasmodium falciparum Resistance to Artemisinin Among Attendees of Selected Health Facilities in Rivers State, Nigeria: https://dx. doi. org …",2021,Nigerian Journal of …,"… Plasmodium falciparum parasite was … for K13 and ATPase 6 genes, who carried the artemisinin-sensitive wild-type allele, none of these isolates exhibited both ATPase 6 and Kelch -13 …",Nigeria
1521,"AM Nji, PTN Niba, PM Netongo, IM Ali, R Ngwafor…",Clinical E cacy and Safety of Artemisinin-based Combination Therapies in the Treatment of Uncomplicated Plasmodium Falciparum Malaria in Cameroon: A …,2021,academia.edu,"… Similarly, systematic reviews and meta-analyses conducted in Ethiopia and Sudan reported similar adverse events when patients with uncomplicated falciparum malaria were …",Cameroon
1526,OK Adebobola,"Prevalence of Mutant Dihydrofolate Reductase Gene (DHFR) and Its Implication on Pyrimethamine Resistance in Rural Kwara State, Nigeria",2021,,… Plasmodium falciparum malaria remains a leading health problem in sub Saharan Africa … of about 28 in the south. Most people at risk of the disease lives in areas of relatively stable …,Nigeria
1572,R Ekodeu,"Evaluation of the effects of Ugandan malaria vector control program strategies on vector control in Kapir Sub-County, Ngora District, Uganda",2021,,"… no significant effect on malaria vector control (Coeff… malaria vector control (Coeff= 0.0277, p = 0.708). Conclusion: The use of insecticide treated nets has no significant effect on malaria …",Uganda
1587,O Ajibaye,"Polymorphisms in Plasmodium falciparummalaria PfAMA1 and PfRH5 Genes in Isolates from Selected Centres in Lagos, Nigeria",2021,,… for treatment ofPlasmodium falciparum malaria as a result … by geopolitical zones and highest in the South- West (50%) … Mutations in the Kelch 13 (K13) -propeller domain were shown to …,Nigeria
1613,J Ball,"Supply and demand research for insecticide treated nets in DR Congo, Ghana, Senegal, Tanzania, Uganda, Zambia",2021,,… 3.0 ITN MARKET IN TANZANIA Tanzania historically has been a leader in research on malaria and malaria control. It was here that the original research on treatment of nets with …,"Ghana, Senegal, Tanzania, Uganda"
1614,O Ajibaye,"Polymorphisms in Plasmodium Falciparummalaria Genes in Isolates from Selected Centres in Lagos, Nigeria",2021,,… for treatment ofPlasmodium falciparum malaria as a result … by geopolitical zones and highest in the South- West (50%) … Mutations in the Kelch 13 (K13) -propeller domain were shown to …,Nigeria
1652,MM Dandare,"Retrospective outcomes and cost analysis of antimalarial treatment in HIV-infected patients in a tertiary hospital setting in Soweto, South Africa",2021,wiredspace.wits.ac.za,… malaria were compared with the South African … South Africa has achieved and exceeded the malaria target of the Millennium Development Goals and has currently targeted malaria …,South Africa
1653,"M Brito, A Soares, C Fançony…","Determinants of malnutrition among under-fives in Bengo province, Angola",2021,Tropical Medicine and …,"… for malaria elimination program. Therefore, the objective of this study was to determine the prevalence of asymptomatic malaria and … Republic of Congo (DRC), we collect these data. …",Angola
1654,"M Brito, C Gasparinho, S Nery, C Mirante…","Determinants of diarrhea in children aged under five at the Bengo General Hospital, Angola",2021,Tropical Medicine …,"… for malaria elimination program. Therefore, the objective of this study was to determine the prevalence of asymptomatic malaria and … Republic of Congo (DRC), we collect these data. …",Angola
1663,"M Namountougou, DD Soma, M Balboné…","Monitoring Insecticide Susceptibility in Aedes Aegypti Populations from the Two Biggest Cities, Ouagadougou and Bobo-Dioulasso, in Burkina Faso …",2021,Tropical Medicine and …,… Sudan-Sahelian area with a short rainy season extending from June to September and an average yearly rainfall of between 600 and 900 mm. Bobo-Dioulasso is located in the Sudan …,Burkina Faso
1701,"S Xia, LV Cosme, J Lutomiah, R Sang, MF Ngangue…",Genetic structure of the mosquito Aedes aegypti in local forest and domestic habitats in Gabon and Kenya,2022,Parasites & …,"… The snmf analysis in LEA with K = 13 (the best number of clusters, Fig. 2b) demonstrated a more detailed population structure within Africa. La Lopé populations and Rabai populations …","Gabon, Kenya"
1714,L Mugisha,Epidemiological study of selected viral pathogens and assessment of responses to polio vaccines in semi-captive chimpanzees in Uganda.,2022,,"2.0 Abstract Confiscated 42 wild-born semi-captive chimpanzees living in a sanctuary on Ngamba Island, Uganda were screened for a broad range of viral pathogens to determine the …",Uganda
1748,T Abu,"“When you preach water and you drink wine” Exploring the implementation, use and management of WASH in healthcare facilities: A Case Study from Kenya",2022,,"Health care facilities (HCFs) are lifesaving resources for the sick in communities however, the inadequacy of basic necessities such as water, sanitation, hygiene, waste management …",Kenya
1755,NJ Parr,An analysis of fertility differentials in Liberia and Ghana using multilevel models,2022,,"This thesis investigates differentials in the levels of fertility, nuptiality and contraceptive use in Liberia and Ghana, using data from the recent Demographic and Health Surveys in these …","Liberia, Ghana"
1756,AM Mohamed,"Arid land agroforestry practices: their role in resource conservation and management in the Daua valley, Mandera District, Kenya",2022,,… In December to February the wind blows mostly from north east to east and general wind direction is from south to south west between May to September. The wind speeds are …,Kenya
1759,"J Magruder, C Ndahimana","Impacts, maintenance and sustainability of irrigation in Rwanda",2022,,"… The baseline in K12, K13, and N23 was conducted in May 2015. There were 3 follow up household surveys conducted in K12, K13, and N23. The first one took place in May and June …",Rwanda
1766,"J Davies, BE O Dochartaigh","Low permeability rocks in sub-Saharan Africa: groundwater development in the Tabora Region, Tanzania",2022,,"… Groundwater use can help reduce health problems associated with unprotected surface water sources, such as malaria, cholera and guinea worm. Alternative water supplies, such as …",Tanzania
1772,MD Graham,"Coexistence in a Land Use Mosaic?: Land Use, Risk and Elephant Ecology in Laikipia District, Kenya",2022,,"This thesis is about the patterns, determinants and consequences of human-elephant interaction in Laikipia District in northern Kenya. Laikipia is located outside of formally protected …",Kenya
1775,MT Asmare,"Reconstructing food systems from the Late Holocene context of Mochena Borago rock shelter, Wolayta, southern Ethiopia",2022,"Unpublished Master's thesis, Addis Ababa: Addis …","… A griddle is large circular utensil which is very common in Ethiopia and Eritrea for baking bread and … Smashed leafs and roots can be used to treat malaria, dysentery and wounds. The …",Ethiopia
1805,DM Mvumbi,"Place de la biologie moléculaire dans l'épidémiologie, le diagnostic et l'évaluation de la chimiorésistance du paludisme en République Démocratique du Congo",2022,,… l’évaluation de la sensibilité de Plasmodium falciparum aux antipaludiques utilisés en RDC. … La présence de certaines mutations sur le gène K13 fut fortement corrélée à la résistance à l…,Congo
1866,D Freudenberger,"Eine „Friendship Bench"" für Uganda?",2022,researchgate.net,"… Hierbei handelt es sich um Hausbesuche, Aufklärung über Krankheiten wie HIV/AIDS, Malaria oder andere gesundheitsgefährdende Risiken sowie gemeinsam gesprochene Gebete. …",Uganda
1880,"ABB Rodrigues, R de Abreu-Fernandes, Z Neto…","Pfkelch13 Plasmodium falciparum Mutations in Huambo, Angola",2022,Pathogens,… falciparum samples were amplified using Pfkelch13 primers. The R471R synonym SNP was … All falciparum malaria patients were aparasitemic on Day 3 according to their thick blood …,Angola
1885,"R Kirby, D Giesbrecht, C Karema…",Examining the Early Distribution of the Artemisinin-Resistant Plasmodium falciparum kelch13 R561H Mutation in Areas of Higher Transmission in Rwanda,2022,Open Forum …,"… Artemisinin resistance mutations in Plasmodium falciparum kelch13 (Pfk13) have begun to emerge in Africa, with Pfk13-R561H being the first reported in Rwanda in 2014, but limited …",Rwanda
1890,"E Talundzic, YD Ndiaye, AB Deme…",Molecular epidemiology of Plasmodium falciparum kelch13 mutations in Senegal determined by using targeted amplicon deep sequencing,2022,Antimicrobial agents …,… to antimalarial drugs for Plasmodium falciparum (1). The recent … malaria-related morbidity and mortality by 54% in Africa (6). … in the Plasmodium falciparum kelch13 gene (Pfk13) have …,Senegal
1922,"A Chidimatembue, SS Svigel, A Mayor, P Aíde…","… for polymorphisms associated with artemisinin-based combination therapy resistance in Plasmodium falciparum isolates collected in Mozambique, 2018",2022,Malaria Journal,"… falciparum kelch 13 (pfk13) gene [10] and ten SNPs in pfk13 gene are currently validated … pfk13 polymorphisms associated with artemisinin partial resistance in Mozambique [17, 18]. …",Mozambique
1924,"D Abera, CK Kibet, T Degefa, L Amenga-Etego…",Genomic analysis reveals independent evolution of Plasmodium falciparum populations in Ethiopia,2022,Malaria Journal,"… type genotype (K) in Malawi. In this analysis no PfKelch13 validated mutations were reported in Ethiopia, DR Congo, and Malawi except a PfK13-K189T African specific uncharacterized …",Ethiopia
1968,"A Mayor, C da Silva, E Rovira-Vallbona…","… surveillance study to detect antimalarial drug resistance, gene deletions of diagnostic relevance and genetic diversity of Plasmodium falciparum in Mozambique …",2022,BMJ open,… functional malaria molecular surveillance system in Mozambique for guiding malaria control … of dense (all malaria clinical cases) and targeted (a selection of malaria clinical cases) …,Mozambique
1973,"I Omedo, B Bartilol, D Kimani…","Spatio-temporal distribution of antimalarial drug resistant gene mutations in a Plasmodium falciparum parasite population from Kilifi, Kenya: A 25 …",2022,Wellcome Open …,"… falciparum amplicon sequencing on 1162 malaria-infected … , Pfdhps, Pfmdr1, Pfexo, Pfkelch13, plasmepsin 2/3, Pfarps10, … , A578S, is also the most predominant Kelch13 mutation in P. …",Kenya
1979,"H Gupta, B Galatas, A Chidimatembue, S Huijben…",Effect of mass dihydroartemisinin–piperaquine administration in southern Mozambique on the carriage of molecular markers of antimalarial resistance,2022,PLoS …,"… deployment for targeted MDA substantially decreased malaria incidence [40]. Similarly, … k13 polymorphisms in Pf isolates collected before and after 3 monthly MDA rounds in Comoros […",Mozambique
1980,"KB Musyoka, JN Kiiru, E Aluvaala, P Omondi…","Prevalence of mutations in Plasmodium falciparum genes associated with resistance to different antimalarial drugs in Nyando, Kisumu County in Kenya",2022,"Infection, Genetics and …","… Here we report a new mutation in K13 propeller gene in malaria parasites isolated from … The genes were Plasmodium falciparum kelch 13 (Pfk13), adaptor protein 2-mu (Pfap2-mu) …",Kenya
2038,"X Iriart, S Menard, P Chauvin…",Misdiagnosis of imported falciparum malaria from African areas due to an increased prevalence of pfhrp2/pfhrp3 gene deletion: the Djibouti case,2022,Emerging microbes & …,… of a falciparum malaria case imported from Djibouti and not … pfhrp2/pfhrp3-deleted parasites in Djibouti using 378 blood samples … on the PfKelch13 protein (data not shown) [Citation14]. …,Djibouti
2052,"C Arlindo, M Alfredo, A Pedro, N Abel, N Lidia…","… surveillance for polymorphisms associated with artemisinin-based combination therapy resistance in Plasmodium falciparum isolates collected in Mozambique, 2018",2023,Malaria Journal …,… Evaluation of the impact of malaria control interventions on all-cause mortality in children under five years of age in Mozambique-Mozambique Malaria Impact Evaluation Group. 2016; p…,Mozambique
2075,"N Brokhattingen, G Matambisso, C da Silva…",Genomic malaria surveillance of antenatal care users detects reduced transmission following elimination interventions in Mozambique,2023,Nature …,… No mutations in the kelch 13 propeller gene (pfkelch13) associated with artemisinin partial … The team of authors combine researchers from Mozambique and non-malaria endemic areas…,Mozambique
2103,"C Salvador, B Rafael, F Matsinhe, B Candrinho…","Efficacy and safety of artemether–lumefantrine for the treatment of uncomplicated falciparum malaria at sentinel sites in Mozambique, 2015",2023,Acta tropica,"… -line ACT, AL, for uncomplicated malaria in Mozambique remains highly efficacious and is well … resistance, including K13, in malaria-endemic countries in Africa, including Mozambique. …",Mozambique
2146,"B Galatas, A Mayor, H Gupta, N Balanza, IK Jang…",Field performance of ultrasensitive and conventional malaria rapid diagnostic tests in southern Mozambique,2023,Malaria journal,"… of the k13 gene was performed [44]. Secondly, samples found positive for k13 gene amplification … Lastly, pfhrp2 and pfhrp3 deletions were considered if k13 gene PCR was positive but …",Mozambique
2179,"A Mayor, N Brokhattingen, G Matambisso…",Genomic malaria surveillance of antenatal care users detects reduced transmission following elimination interventions in Mozambique,2023,Research …,"… Malaria burden trends in pregnant women at their first ANC visit have been shown to mirror community trends, 17 and routine malaria testing … in the kelch 13 propeller gene, pfkelch13, …",Mozambique
2220,"HG Himanshu Gupta, G Matambisso, B Galatas…",Molecular surveillance of pfhrp2 and pfhrp3 deletions in Plasmodium falciparum isolates from Mozambique.,2023,,"… isolates (n=1162) collected in Southern Mozambique were … using gene-specific PCRs, with kelch13 PCR as the parasite DNA … falciparum infections. Nevertheless, active surveillance for …",Mozambique
2266,"G Martínez-Pérez, DP Lansana, S Omeonga, H Gupta…","Prevalence of Plasmodium falciparum infection among pregnant women at first antenatal visit in post-Ebola Monrovia, Liberia",2023,Malaria Journal,"… In the present study, only one synonymous k13 polymorphism was observed among the P. falciparum isolates tested, thus demonstrating the absence of genetic evidences of …",Liberia
2314,"S Nag, J Ursing, A Rodrigues, M Crespo, C Krogsgaard…","Proof of concept: Malaria rapid diagnostic tests and massively parallel sequencing for surveillance of molecular markers of antimalarial resistance in Bissau, Guinea …",2023,bioRxiv,"… malaria rapid diagnostic tests (RDTs) can be used for massive parallel amplicon sequencing. RDTs used for malaria … Importantly, the current study revealed no SNPs of concern in pfK13 …",Guinea
2363,"J Raman, E Allen, L Workman, A Mabuza…","Safety and tolerability of single low-dose primaquine in a low-intensity transmission area in South Africa: an open-label, randomized controlled trial",2023,Malaria Journal,… across the border shared with Mozambique [40]. The predominant malaria parasite is P. … falciparum kelch13 gene (XM_001350122.1) using a BLAST search and BioEdit Software to …,South Africa
2368,"ER Ebel, F Reis, DA Petrov…",Changing anti-malarial drug use in Angola has shaped the trajectories of P. falciparum resistance alleles,2023,… GENOMICS OF MALARIA …,"… , dhfr , and kelch13 . Similar allele frequency data were also gathered from studies published on Angolan P. falciparum in the last two decades. For every locus but kelch13 , we found …",Angola
2426,"K Diongue, SA Sy, M Sy, MC Seck, M Ndiaye, B Dieye…",Efficacy and safety of artemisinin-based combination therapy and the implications of Pfkelch13and Pfcoroninmolecular markers in treatment failure in Senegal,2024,academia.edu,"… simultaneously the sequences of Pfk13 and Pfcoronin on … open-label, two-cohort, clinical trial in Mozambique. Malar. J. … of uncomplicated malaria and investigation of mutations in k13 …",Senegal
2436,"N Casamitjana, T Machai-Macete","PA-453 Building an innovative long-term collaboration for strengthening the research capacity, the research environment and the scientific leadership in Mozambique",2024,,"… falciparum and no validated Pfk13 mutation associated with artemisinin drug resistance in this study setting, suggesting that ACTs remain effective in the area, but required continuous …",Mozambique
